index,published,topic,term,domain,language,valid,de,title,description,en,la,url,image,archive,content,quote,added,feed,country,ipcc,continent
fc85c683429fb53aceec3c7fc60b87d2,2026-05-07T11:27:23Z,Thunderstorm,burza,tvn24.pl,pl,0.9,"Wo ist der Sturm? In Teilen des Landes donnert es immer noch. Wetter in Polen. Auch am Donnerstagabend, 7. Mai, sind in Teilen des Landes noch Unwetter aktiv. Der Blitz wird von Regenfällen und starken Winden begleitet. Überprüfen Sie, wo es noch blinkt.",Gdzie jest burza? Wciąż grzmi w części kraju,"Pogoda w Polsce. W czwartek 7.05 wieczorem w części kraju wciąż aktywne są burze. Wyładowaniom towarzyszą opady deszczu i silny wiatr. Sprawdź, gdzie nadal się błyska.","Where is the storm? There's still thunder in parts of the country. Weather in Poland. On Thursday, May 7 in the evening, storms are still active in parts of the country. The lightning is accompanied by rainfall and strong winds. Check where it's still flashing.",Ubi est tempestas? Adhuc tonat in partibus patriae. Tempestas in Polonia. Die Iovis VII mensis Maii vesperi tempestates adhuc activae sunt in partibus patriae. Fulgura cum pluviis et ventis validis comitatur. Reprehendo ubi suus adhuc coruscans.,https://tvn24.pl/tvnmeteo/polska/gdzie-jest-burza-burze-w-polsce-w-czwartek-7-05-mapa-i-radar-burz-slychac-pierwsze-grzmoty-st9036000,https://tvn24.pl/_e/i/najnowsze/cdn-zdjecie-jm4p5l-noc-burza-piorun-pioruny-chmury-pogoda-ph7925662/alternates/WEBP_LANDSCAPE_840,,"Pogoda w Polsce. W czwartek 7.05 wieczorem w czci kraju wci aktywne s burze. Wyadowaniom towarzysz opady deszczu i silny wiatr. Sprawd, gdzie nadal si byska.
Jak poinformowaa w czwartek wieczorem sy… [+600 chars]",,2026-05-13 17:34:24+00:00,random,,,
7ff877dcc8dd42482a0c3ffc842050f1,2026-05-07T14:36:20Z,Thunderstorm,burza,wiadomosci.wp.pl,pl,0.9,"Es wird in der Nacht beginnen. Ein radikaler Wetterumschwung steht bevor. Das IMWM gab für sieben Woiwodschaften, hauptsächlich im Südosten Polens, Sturmwarnungen ersten Grades heraus. Es werden Niederschlagsmengen von bis zu 35 Litern pro Quadratmeter, Windböen von bis zu 70 km/h und mancherorts Hagel erwartet.",Zacznie się w nocy. Nadciąga radykalna zmiana w pogodzie,"IMGW wydał ostrzeżenia I st. przed burzami dla siedmiu województw, głównie w południowo-wschodniej Polsce. Spodziewane są opady do 35 litrów na metr kwadratowy, porywy wiatru do 70 km/h, a miejscami grad.","It will start at night. A radical change in the weather is coming. IMWM issued first-degree storm warnings for seven voivodeships, mainly in south-eastern Poland. Rainfall of up to 35 liters per square meter, wind gusts of up to 70 km/h, and hail are expected in some places.","Nocte incipiet. Tempestas radicalis mutationis venit. IMWM primo-gradum tempestatis monita pro septem voivodetis, maxime in Polonia meridionali-orientali. Pluuiae usque ad 35 litres per metrum quadratam, procellae venti usque ad 70 km/h, et grando in nonnullis locis expectatur.",https://wiadomosci.wp.pl/zacznie-sie-w-nocy-nadciaga-radykalna-zmiana-w-pogodzie-7283357891340320a,https://v.wpimg.pl/MWViMDMyYjY3Czt3YgJvI3RTby0kW2F1I0t3ZmJIf2NmEXpyfVYrPjoMPyE9FmMwJBw9JToJYyc6Riw0JFY7ZnkNJDc9FSwueQwgJigdYmVnWiwlKUp0emYLKHRgTXUzYUQvd3xLYGcwCnwhL0l-ZTBceGYw,,"Najwaniejsze informacje:
<ul><li>Ostrzeenia IMGW obowizuj od godz. 14 w czwartek do godz. 4 w pitek.</li><li>Strefa burz obejmuje m.in. Lubelszczyzn, Maopolsk i Podkarpacie; lokalnie moliwy grad i p… [+1720 chars]",,2026-05-13 17:34:24+00:00,random,,,
124e0881a602a3f28c951b29f8095141,2026-05-11T06:03:52Z,Thunderstorm,grad,kobieta.interia.pl,pl,0.9,"Wir werden eine deutliche Abkühlung spüren. In den Bergen wird es wieder weiß. Für die nächsten Tage sollte man die Mitnahme eines Regenschirms besser nicht vergessen. In fast ganz Polen wird es vereinzelt regnen, örtlich kommt es auch zu Gewittern mit Hagel. In den Bergen wird ein Anstieg der Schneedecke um 10 cm prognostiziert. Wird sich das Wetter dieses Wochenende ändern?",Odczujemy spore ochłodzenie. W górach znowu zrobi się biało,"Przez kilka najbliższych dni lepiej nie zapominać o zabraniu parasola. Niemal w całej Polsce czekają nas przelotne opady deszczu, lokalnie pojawią się również burze z gradem. W górach prognozowany jest przyrost pokrywy śnieżnej o 10 cm. Czy w weekend aura się…","We will feel a significant cooling. It will become white again in the mountains. For the next few days, it's better not to forget to take an umbrella. There will be scattered rain almost all over Poland, and there will also be thunderstorms with hail locally. An increase in snow cover of 10 cm is forecast in the mountains. Will the weather change this weekend...","Significans refrigerationem sentiemus. Candida rursus in montibus fiet. Paucis diebus in umbella oblivisci melius est. Imber fere per totam Poloniam dispergentur, et cum grandine localiter eciam tonitribus erunt. Augmentum nivis tegumento 10 cm providetur in montibus. Tempestas hoc erit mutare volutpat vestibulum ...","https://kobieta.interia.pl/newsy/news-w-kilku-regionach-przyrost-pokrywy-snieznej-o-10-cm-zbliza-s,nId,23475487",https://i.iplsc.com/-/000HXA670DYOJORT-C461.jpg,,"Jaka bdzie pogoda w najbliszych dniach?
W poniedziaek przewanie zachmurzenie umiarkowane i due. W wielu regionach kraju przelotne opady deszczu, po poudniu miejscami burze, take z gradem - prognozuj… [+2588 chars]",,2026-05-13 17:34:24+00:00,random,,,
9fe4d3ed5fd1682609aad58497ee85c5,2026-05-11T13:25:40Z,Thunderstorm,grad,wiadomosci.wp.pl,pl,0.9,"IMWM-Warnungen für fast ganz Polen. Eine gefährliche Nacht liegt vor uns. Das IMWM gab für 14 Woiwodschaften Warnungen ersten Grades vor Unwettern heraus. Windböen bis 75 km/h, örtlich kleiner Hagel und stärkere Regenfälle sind möglich. Zusätzliche Warnungen für starke Regenfälle bedecken Teile der Provinz. Schlesien und Kleinpolen.",Alerty IMGW dla niemal całej Polski. Groźna noc przed nami,"IMGW wydał ostrzeżenia I stopnia przed burzami dla 14 województw. Możliwe są porywy wiatru do 75 km/h, lokalnie drobny grad oraz silniejsze opady. Dodatkowe alerty przed intensywnym deszczem obejmują część woj. śląskiego i małopolskiego.","IMWM alerts for almost all of Poland. A dangerous night lies ahead. IMWM issued first degree warnings against storms for 14 voivodeships. Wind gusts up to 75 km/h, locally small hail and heavier rainfall are possible. Additional alerts for heavy rain cover parts of the province. Silesia and Lesser Poland.","IMWM summis fere omnibus Polonis. Nox praecessit periculosa. IMWM primo gradu monita contra procellas pro 14 voivodeships edita. Ventorum procellae usque ad 75 km/h, localiter grandines parvae et pluviae graviores possibilia sunt. Additamenta summis pluvialibus partibus provinciac tegunt. Silesiae et Poloniae minoris.",https://wiadomosci.wp.pl/alerty-imgw-dla-niemal-calej-polski-grozna-noc-przed-nami-7284754180298784a,https://v.wpimg.pl/ZmRiNDJidQwzCzh3ZRJ4GXBTbC0jS3ZPJ0t0ZmVYaFliEXlyekY8BD4MPCE6BnQKIBw-JT0ZdB0-Ri80I0YsXH0NJzc6BTsUfQwjJi8NdVkxUH4nfQo4QDALenFnXTtcMUQsc3NZd11hDyggKF1oD2MKL2Y3,,<ul><li>Ostrzeenia IMGW I stopnia przed burzami dotycz 14 województw i obowizuj od poniedziaku godz. 14.00 do wtorku godz. 1.00.</li><li>W trakcie burz prognozowane s opady do ok. 20 mm oraz porywy w… [+1499 chars],,2026-05-13 17:34:24+00:00,random,,,
9cc4e70c83281e6d3fe6ed8fb9bcccd7,2026-05-11T13:49:32Z,Precipitation,ulewa,wydarzenia.interia.pl,pl,0.9,"Die „kalten Gärtner“ kommen bereits zu uns. Sie werden mehreren Regionen frostige Nächte bescheren. Ein ruhiger und trockener Frühling geht zu Ende. Es kommt zu gravierenden Wetterumschwüngen, die fast überall zu spüren sein werden. Gewitter mit Regenfällen traten am Montag auf und werden auch in den folgenden Tagen auftreten. Gleichzeitig wird es eine spürbare Abkühlung geben: Bald...","""Zimni ogrodnicy"" już do nas idą. Przyniosą mroźne noce do kilku regionów","Spokojna i sucha wiosna właśnie się kończy. W pogodzie zachodzą poważne zmiany, które odczujemy praktycznie wszędzie. Burze z ulewami pojawiły się w poniedziałek i w kolejnych dniach również się pojawią. Jednocześnie nastąpi wyraźne ochłodzenie: wkrótce za dn…","The ""cold gardeners"" are already coming to us. They will bring frosty nights to several regions. A calm and dry spring is coming to an end. There are serious changes in the weather that will be felt almost everywhere. Thunderstorms with downpours appeared on Monday and will also occur in the following days. At the same time, there will be a noticeable cooling: soon...","""Frigidi hortulani"" iam ad nos veniunt. Noctes gelidas in varias regiones afferent. Vere tranquillus et siccus ad finem venit. Gravissimae mutationes tempestatum fere ubique sentientur. Procellae cum passibus die Lunae apparuerunt et etiam diebus sequentibus occurrent. Eodem tempore notabilis erit refrigeratio: mox...","https://wydarzenia.interia.pl/kraj/news-rozpoczyna-sie-seria-zmian-w-pogodzie-zrobi-sie-niebezpieczn,nId,23476240",https://i.iplsc.com/-/000MRMWKX3JJ4YGG-C461.jpg,,"W skrócie
<ul><li>
Pogoda ulega zmianie spodziewane jest ochodzenie, burze oraz wystpienie przymrozków zwanych ""zimnymi ogrodnikami"".
</li><li>
Pojawiaj si burze i coraz intensywniejsze opady des… [+4174 chars]",,2026-05-13 17:34:24+00:00,random,,,
aefa66c41a1f4f41e644f7101ed04322,2026-05-12T08:46:58Z,Precipitation,intensywne opady,wiadomosci.wp.pl,pl,0.9,"Abkühlung, Schnee in den Bergen und Regengüsse. Das ist es, was uns erwartet. Das Institut für Meteorologie und Wasserwirtschaft stellte die Prognose für die kommenden Tage vor. Polen steht vor einer deutlichen Abkühlung. In vielen Regionen kommt es zu heftigen Regenfällen, Stürmen und Hagel. In der Tatra wird es schneien, und in der Nacht von Mittwoch auf Donnerstag wird er wieder auf den Boden fallen...","Ochłodzenie, śnieg w górach i ulewy. To nas czeka","Instytut Meteorologii i Gospodarki Wodnej przedstawił prognozę na najbliższe dni. Polskę czeka wyraźne ochłodzenie. W wielu regionach wystąpią intensywne opady deszczu, burze oraz grad. W Tatrach spadnie śnieg, a w nocy ze środy na czwartek powrócą przygrunto…","Cooling, snow in the mountains and downpours. This is what awaits us. The Institute of Meteorology and Water Management presented the forecast for the coming days. Poland is facing a significant cooling. Many regions will experience heavy rainfall, storms and hail. Snow will fall in the Tatra Mountains, and on the night from Wednesday to Thursday they will return to the ground...","Tityre, nix in montibus et imbres. Hoc est quod nos manet. Institutum Meteorologicum et Procuratio Aquarum praesagio futurorum dierum praesentavit. Polonia respicit significativa refrigerationem. Multae regiones pluvias, tempestates et grandinem experientur. Nix in Montes Tatra cadet, et nocte a Mercurii ad Iovis terram revertentur...",https://wiadomosci.wp.pl/ochlodzenie-snieg-w-gorach-i-ulewy-to-nas-czeka-7285038264104001v,https://v.wpimg.pl/NjMxOWEuYQssGjlkag5sHm9CbT4sV2JIOFp1dWpEfF59AHhhdVo5GjkOYiI1GSELKVUuJyxbORouHCF5NRlhDHhOKjUjEC1HLx0rNWhBKF0vVXdkdUxjDn5AKTIgF3hZfEEueTUbKUgw,,"Instytut Meteorologii i Gospodarki Wodnej przedstawi prognoz na najblisze dni. Polsk czeka wyrane ochodzenie. W wielu regionach wystpi intensywne opady deszczu, burze oraz grad. W Tatrach spadnie nie… [+2906 chars]",,2026-05-13 17:34:24+00:00,random,,,
b46c312d9d153a08f95ab5eefff80454,2026-05-06T07:01:41Z,Storm,wezbranie sztormowe województwo łódzkie powiat poddębicki,wiadomosci.wp.pl,pl,0.3,Eine Mauer aus Regen und heftigen Stürmen über Polen. Es gibt die aktuelle Wettervorhersage. Die kommenden Tage werden ein wahres Fest der meteorologischen Extreme sein. Das Institut für Meteorologie und Wasserwirtschaft lässt keinen Zweifel daran: Europa ist von tiefen Tiefstständen und dynamischen atmosphärischen Fronten erfasst. Polen ist gerade zur Arena der Stars geworden…,Ściana deszczu i gwałtowne burze nad Polską. Jest najnowsza prognoza pogody,Nadchodzące dni to prawdziwy festiwal meteorologicznych skrajności. Instytut Meteorologii i Gospodarki Wodnej nie pozostawia złudzeń – Europa znalazła się w kleszczach głębokich niżów i dynamicznych frontów atmosferycznych. Polska stała się właśnie areną star…,A wall of rain and violent storms over Poland. There is the latest weather forecast. The coming days will be a real festival of meteorological extremes. The Institute of Meteorology and Water Management leaves no doubts - Europe is in the grip of deep lows and dynamic atmospheric fronts. Poland has just become the arena of star…,Murus pluviae et procellae violentae per Poloniam. Est tardus tempestas praenuntientur. Dies adventus erit realis festivitas extrema meteorologicorum. Institutum Meteorologicum et Management Aquarum nullas dubitationes relinquit - Europa tenet profundas vias et dynamicas frontes atmosphaericas. Polonia modo fiet arena stellae...,https://wiadomosci.wp.pl/sciana-deszczu-i-gwaltowne-burze-nad-polska-jest-najnowsza-prognoza-pogody-7282893697336385v,https://v.wpimg.pl/YzkyOTkudhsKGzlnRA57DklDbT0CV3VYHlt1dkREa05bAXhiW1ouCh8PYiEbGTYbD1QuJAJbLgoIHSF6Gxl2Q1tMeDUJQmBXXx19bUZBOBhZVC1gD0N0GFhAeW1ZFDpDWUB2ehsbPlgW,,Nadchodzce dni to prawdziwy festiwal meteorologicznych skrajnoci. Instytut Meteorologii i Gospodarki Wodnej nie pozostawia zudze Europa znalaza si w kleszczach gbokich niów i dynamicznych frontów atm… [+2689 chars],,2026-05-13 21:51:14+00:00,wmo,Poland,WCE,Europe
fdf12fb73f4f9ef82287624a9aef57f9,2026-05-14T14:48:11Z,Thunderstorm,grad województwo łódzkie powiat piotrkowski,wydarzenia.interia.pl,pl,0.3,"Sommer außerhalb der Norm. Drei Monate hintereinander in ganz Polen rot. Der Frühling beeindruckt nicht, der Sommer bereitet einen Wettertest vor. Nach einem kühlen und trockenen April und Mai wird es große Veränderungen geben. Es sieht so aus, als würde es ab Juni richtig heiß werden – heißer als sonst. In ganz Polen werden die Temperaturen überdurchschnittlich hoch sein, so dass…",Lato poza normą. Trzy miesiące z rzędu na czerwono w całej Polsce,"Wiosna nie zachwyca, lato szykuje pogodowy sprawdzian. Po chłodnym i suchym kwietniu oraz maju nastąpią poważne zmiany. Wygląda na to, że od czerwca zrobi się naprawdę gorąco - bardziej niż zazwyczaj. W całej Polsce temperatury będą wyższe od średniej, więc f…","Summer outside the norm. Three months in a row in red throughout Poland. Spring does not impress, summer is preparing a weather test. After a cool and dry April and May, there will be major changes. It looks like it's going to get really hot from June - more hot than usual. Throughout Poland, temperatures will be higher than average, so f…","Aestas extra normam. Tres menses in ordine rubeo per totam Poloniam. Ver non imprimit, aestas tempestatem expertus parat. Post frigidum et siccum Aprilis et Maius mutationes maiores erunt. Is vultus amo futurum ut vere ab Iunio caldarium - plus solito quam calidum sit. In Polonia, temperaturas mediocris erit altior, sic f…","https://wydarzenia.interia.pl/kraj/news-trzy-miesiace-poza-norma-powazne-zmiany-zaczna-sie-za-kilka,nId,23477991",https://i.iplsc.com/-/000MSCZ27J4XE7RC-C461.jpg,,"W skrócie
<ul><li>
W czerwcu w caej Polsce prognozowane s temperatury powyej redniej, wtedy powinny si zacz fale upaów.
</li><li>
Lato bdzie gorce, kolejne miesice bd cieplejsze od redniej we wsz… [+4401 chars]",,2026-05-15 21:34:11+00:00,wmo,Poland,WCE,Europe
3c1ddab28db0a8d56544a7d880b57c0a,2026-05-07T07:44:07Z,Thunderstorm,burza,sport.interia.pl,pl,0.7,"Sturm nach der Wahl dieses Maskottchennamens für die Weltmeisterschaft in Polen. „Ist das ein Witz?“ Der polnische Fußballverband gab offiziell die Entscheidung bekannt, den Namen des Maskottchens für die in Polen stattfindende Frauen-Jugend-Weltmeisterschaft zu wählen. Die Fans reagierten ungläubig auf die in der Mitteilung des Verbandes enthaltenen Neuigkeiten. „Was ist das überhaupt für ein Name?“ „Es ist ein Witz, oder?“ „Was ist das...","Burza po wyborze tego imienia maskotki na mundial w Polsce. ""To jest żart?""","PZPN oficjalnie ogłosił decyzję dotyczącą wyboru imienia maskotki na organizowany w Polsce młodzieżowy mundial kobiet. Kibice z niedowierzaniem przyjęli wiadomości zawarte w komunikacje federacji. ""Co to jest w ogóle za imię?, ""To jest żart, prawda?"", ""Co to …","Storm after the choice of this mascot name for the World Cup in Poland. ""Is this a joke?"" The Polish Football Association officially announced the decision to choose the name of the mascot for the women's youth World Cup organized in Poland. The fans reacted with disbelief to the news contained in the federation's communication. ""What kind of name is that anyway?"" ""It's a joke, right?"" ""What's that...","Tempestas post electionem huius terque nominis pro Trophaeo Mundi in Polonia. ""Estne hic iocus?"" Societas Football Eucalytica publice denuntiavit consilium eligendi nomen mascot pro iuventute Mundialis mulierum in Polonia constituto. Fans cum incredulitate portaverunt ad nuntium in communicatione foederationis contentum. ""Quod nomen est usquam?"" ""Est iocus, vox?"" ""Quid est hoc.","https://sport.interia.pl/pilka-nozna/news-polska-podjela-decyzje-ws-mundialu-a-jednak-burza-po-wyborze,nId,23474043",https://i.iplsc.com/-/000MR08QQWD4JC2A-C461.jpg,,"Polski Zwizek Piki Nonej oficjalnie ogosi decyzj dotyczc kobiecego modzieowego mundialu, który odbdzie si u nas w tym roku. I tak oficjaln maskotk Mistrzostw wiata FIFA U-20 Kobiet w Polsce zostaa Is… [+2582 chars]",,2026-05-19 13:40:30+00:00,random,,,
8226b9c9d024d7a42dfe43b241d5657a,2026-05-18T08:04:00Z,Precipitation,opady w polsce,wiadomosci.gazeta.pl,pl,0.7,"Gewitter in sechs Woiwodschaften. IMWM hat Warnungen herausgegeben. In Polen herrschen starke Wolkendecke und Regenfälle. Gewitter sind im Osten, Nordosten, in der Mitte und im Bieszczady-Gebirge möglich - sagt IMWM.",Burze w sześciu województwach. IMGW wydał alerty,"W Polsce dominuje duże zachmurzenie i opady deszczu. Na wschodzie, północnym wschodzie, w centrum oraz w Bieszczadach możliwe burze - podaje IMGW.","Thunderstorms in six voivodeships. IMWM issued alerts. Heavy cloud cover and rainfall prevail in Poland. Thunderstorms are possible in the east, north-east, in the center and in the Bieszczady Mountains - says IMWM.","Procellae in sex voivodeships. IMWM latis summis. Gravis nubes operit et pluviae in Polonia praevalent. Tempestates possibilis sunt in oriente, septentrione et oriente, in centro et in montibus Bieszczady — IMWM dicit.","https://wiadomosci.gazeta.pl/polska/7,198072,32795873,burze-w-szesciu-wojewodztwach-imgw-wydal-alerty.html","https://bi.im-g.pl/im/83/46/1f/z32792707IER,Burza--zdjecie-ilustracyjne-.jpg",,"Nad zachodni i wschodni Europ przewaa bd nie z ukadami frontów atmosferycznych, natomiast nad pozosta czci kontynentu dominowa bd wye.
Zachodnia Polska znajdzie si w zasigu klina wyu znad Finlandii,… [+1977 chars]",,2026-05-19 13:40:30+00:00,wmo,Poland,WCE,Europe
0b3880695349bdf3876bae91478748fa,2026-05-10T17:24:00Z,Thunderstorm,burza,www.plotek.pl,pl,0.9,Berühmtheiten stehen nach einer Techno-Party in Wilanów unter Beschuss. Maffashion: Ich klopfe mir auf die Brust. Nach der Circoloco-Techno-Veranstaltung in Wilanów brach im Internet ein Sturm aus. Es sprach unter anderem: Karolina Korwin-Piotrowska. Einen Moment später veröffentlichte Maffashion eine Entschuldigung.,Celebryci pod ostrzałem po imprezie techno w Wilanowie. Maffashion: Biję się w pierś,Po imprezie techno Circoloco w Wilanowie w internecie rozpętała się burza. Głos zabrała m.in. Karolina Korwin-Piotrowska. Chwilę później przeprosiny opublikowała Maffashion.,"Celebrities under fire after a techno party in Wilanów. Maffashion: I'm beating my chest. After the Circoloco techno event in Wilanów, a storm broke out on the Internet. She spoke, among others: Karolina Korwin-Piotrowska. A moment later, Maffashion published an apology.","Celebritates sub igne post factionem technam in Wilanów. Maffashion: Pectus meum percutio. Post Circoloco techno eventu in Wilanów, tempestas in Interreti orta est. Dixit inter alios: Karolina Korwin-Piotrowska. Momento post Maffashion excusationem edidit.","https://www.plotek.pl/celebryci/7,198202,32781344,celebryci-pod-ostrzalem-po-imprezie-techno-w-wilanowie-maffashion.html","https://bi.im-g.pl/im/2d/43/1f/z32781357IER,Maffashion.jpg",,"<ul><li>Festiwal Circoloco, który odby si 9 maja w okolicach Paacu w Wilanowie, wywoa fal krytyki z powodu doniesie o mieciach, zniszczeniach terenu i moliwym wpywie imprezy na pobliski rezerwat Mory… [+2955 chars]",,2026-05-19 13:40:30+00:00,random,,,
9537551d47d4d1e9ab357c137c4ea547,2026-05-13T09:36:00Z,Thunderstorm,burza,kobieta.gazeta.pl,pl,0.9,"In Bezug auf LGBT+-Rechte liegt Polen am hinteren Ende Europas. Das Regenbogen-Ranking enthüllt die traurige Wahrheit. Obwohl in letzter Zeit ein regelrechter politischer Sturm rund um die gleichgeschlechtliche Ehe ausgebrochen ist, bringt das neueste Regenbogen-Ranking die Emotionen schnell auf den Boden der Tatsachen. Europa weitet die Rechte von LGBT+-Personen immer mutiger aus und Polen findet sich erneut am Ende der Rangliste wieder...",Polska w ogonie Europy pod względem praw osób LGBT+. Tęczowy ranking zdradza smutną prawdę,"Choć wokół małżeństw jednopłciowych wybuchła ostatnio prawdziwa polityczna burza, najnowszy tęczowy ranking szybko sprowadza emocje na ziemię. Europa coraz śmielej rozszerza prawa osób LGBT+, a Polska po raz kolejny ląduje w końcówce zestawienia oceniającego …","Poland is at the tail end of Europe in terms of LGBT+ rights. The rainbow ranking reveals the sad truth. Although a real political storm has recently erupted around same-sex marriage, the latest rainbow ranking quickly brings emotions down to earth. Europe is more and more boldly expanding the rights of LGBT+ people, and Poland once again finds itself at the bottom of the ranking...","Polonia in cauda extremitatis Europae secundum iura LGBT+ est. Iris ordo tristem aperit veritatem. Etsi tempestas realis politica circa matrimonium idem sexus nuper erupit, ultimae iris ordo cito motus in terram deducit. Europa magis ac audacius dilatatur iura populi LGBT+, et Polonia iterum se in fundo ordo invenit.","https://kobieta.gazeta.pl/zycie-i-styl/7,197810,32786810,polska-w-ogonie-europy-pod-wzgledem-praw-osob-lgbt-teczowy.html","https://bi.im-g.pl/im/cf/ef/1e/z32439247IER,Parada-Rownosci-pod-haslem--Odpowiedzia-jest-milos.jpg",,"Jeszcze niedawno pary jednopłciowe zawierające małżeństwo za granicą wracały do Polski z poczuciem, że ich zwizek nagle przestaje istnieć w oczach państwa. Dokument ważny w Berlinie, Madrycie lub Ams… [+6580 chars]",,2026-05-19 13:40:30+00:00,random,,,
d0b971cf919c6f284184786c7d5cbf74,2026-05-03T05:11:00Z,Tropical Cyclone,lek,kobieta.gazeta.pl,pl,0.7,"Bestehend aus Viskose und Leinen und mit dem angesagtesten Muster dieser Saison – dieses Hemd sucht seinesgleichen. Es gibt einige Hemden, die man sofort mit dem Sommer assoziiert. Leicht, luftig und mit modischem Muster. Dieses Modell von Sinsay besteht aus Viskose und Leinen und sieht daher von Anfang an gut aus","W składzie wiskoza i len, a wzór najmodniejszy w tym sezonie - ta koszula nie ma sobie równych","Są takie koszule, które od razu kojarzą się z latem. Lekkie, przewiewne i do tego w modny wzór. Ten model z Sinsay ma w składzie wiskozę i len, więc już na starcie zapowiada się dobrze","Composed of viscose and linen, and with the most fashionable pattern this season - this shirt is second to none. There are some shirts that are immediately associated with summer. Light, airy and with a fashionable pattern. This model from Sinsay contains viscose and linen, so it looks good from the very beginning","Ex viscoso et lino componitur, et cum exemplaribus pulcherrimis hoc tempore — haec tunica nulli est secunda. Sunt aliquae tunicae quae immediate aestate coniunguntur. Luce , aereo , et cum luxu exemplari. Exemplar hoc de Sinsay viscosum et linum continet, unde ab initio bonum spectat","https://kobieta.gazeta.pl/zycie-i-styl/7,197850,32758677,w-skladzie-wiskoza-i-len-a-wzor-najmodniejszy-w-tym-sezonie.html","https://bi.im-g.pl/im/a6/32/1f/z32712102IER,Koszula-w-paski.jpg",,"W cieplejsze dni zaczynamy zwracać większą uwagę na materiały. To już nie tylko kwestia stylu, ale też komfortu noszenia. Dlatego koszule z domieszką lnu i wiskozy co roku wracają do łask i szybko zn… [+1622 chars]",,2026-05-19 21:53:57+00:00,random,,,
