index,published,topic,term,domain,language,valid,de,title,description,en,la,url,image,archive,content,quote,added,feed,country,ipcc,continent
96c00886cc06ce97213109076756a072,2026-05-20T12:17:31Z,Snow&Ice,kry,antyweb.pl,pl,0.9,"Die Wissenschaft hat einen Weg gefunden, schönes und gesundes Haar zu schaffen. Viele von uns haben es zu Hause. Methylenblau, eine Substanz, die von der medizinischen Industrie und von Heimaquarienbesitzern verwendet wird, stimuliert die Aktivität menschlicher Haarfollikel-Stammzellen. Die Studie, die den Mechanismus aufgedeckt hat, bietet uns noch keine 100-prozentige Therapie, deutet aber bereits darauf hin …",Nauka odkryła sposób na piękne i zdrowe włosy. Wielu z nas ma go w domu,"Błękit metylenowy, substancja używana przez branżę medyczną oraz posiadaczy akwariów w domach, pobudza aktywność ludzkich komórek macierzystych mieszków włosowych. Badanie, które ujawniło mechanizm, nie daje nam jeszcze stuprocentowanych terapii, ale już wska…","Science has discovered a way to create beautiful and healthy hair. Many of us have it at home. Methylene blue, a substance used by the medical industry and home aquarium owners, stimulates the activity of human hair follicle stem cells. The study that revealed the mechanism does not yet provide us with 100% therapy, but it already indicates…","Scientia viam invenit capillos pulchros et sanos. Multos nos domi habemus. Methylene hyacinthina, substantia adhibita industria medici et domicilii aquarium possessorum, stimulat activitatem cellulae caulis folliculi capillorum humanorum. Studium mechanismi revelatum nondum nobis cum 100 therapiis praebet, sed iam indicat...",https://antyweb.pl/mieszki-wlosowe-blekit-metylenowy,"https://static.antyweb.pl/img/w_1250,h_550/wp-content/uploads/2026/05/wlosy-2.jpeg",,"Bkit metylenowy jest znany z wielu rzeczy: stosuj go np. hodowcy ryb w domowych akwariach, ale dotd... nikt nie czy go z terapi w leczeniu ysienia. Zespó Kavithy Sadashivaiah, Huijing Xue i Kan Cao o… [+5177 chars]",,2026-05-31 08:26:15+00:00,random,,,
83d60d14b5848fb07b07974e6b38fee3,2026-05-20T12:48:00Z,Tropical Cyclone,lek,next.gazeta.pl,pl,0.9,"GIF gab eine dringende Ankündigung heraus. Haben Sie dieses Medikament zu Hause? Sie haben es in ganz Polen zurückgezogen. Ein beliebtes Präparat zur Behandlung von Mund- und Halsentzündungen wird in ganz Polen aus den Apotheken verschwinden. Die Entscheidung von GIF wurde nach Analyse der Ergebnisse von Labortests getroffen, die Unregelmäßigkeiten in der Qualität des Produkts zeigten.",GIF wydał pilny komunikat. Masz ten lek w domu? Wycofali go w całej Polsce,"Popularny preparat stosowany przy stanach zapalnych jamy ustnej i bólu gardła zniknie z aptek w całej Polsce. Decyzja GIF zapadła po analizie wyników badań laboratoryjnych, które wykazały nieprawidłowości dotyczące jakości produktu.","GIF issued an urgent announcement. Do you have this medicine at home? They withdrew it throughout Poland. A popular preparation used to treat inflammation of the mouth and sore throat will disappear from pharmacies throughout Poland. GIF's decision was made after analyzing the results of laboratory tests, which showed irregularities in the quality of the product.","GIF denuntiatio urgente edita. Habesne hanc medicinam domi? Retraxerunt eam per totam Poloniam. Praeparatio popularis adhibita inflammationem oris tractabat et faucium a medicamentis per Poloniam evanescet. Decretum GIF factum est post analysin eventus probatorum laboratorium, qui irregularitates in qualitate facti demonstraverunt.","https://next.gazeta.pl/next/7,151003,32801752,gif-wydal-pilny-komunikat-masz-ten-lek-w-domu-wycofali-go.html","https://bi.im-g.pl/im/20/42/1c/z29632288IER,Apteka--zdjecie-ilustracyjne-.jpg",,"Główny Inspektor Farmaceutyczny zdecydował o wycofaniu z obrotu kilku serii produktu Envil gardło. Chodzi o aerozol do stosowania w jamie ustnej, który jest często używany przy bólu gardła i stanach … [+1823 chars]",,2026-05-31 08:26:15+00:00,random,,,
7d0613339d291c2e7534eabc302d604e,2026-05-20T14:43:00Z,Tropical Cyclone,lek,next.gazeta.pl,pl,0.9,"Das Krebsmedikament in der Apotheke sollte 15.000 PLN kosten. Loch. Sie verkaufen es online für 40 Dollar. Eine Krebsdiagnose veränderte schlagartig das Leben von Debbie Rhodes und ihrem Mann. Der größte Schock kam jedoch später, als sich herausstellte, dass die zur Bekämpfung der Krankheit benötigten Medikamente ohne entsprechende Versicherung bis zu mehrere tausend Dollar pro Monat kosten könnten ...",Lek na raka w aptece miał kosztować 15 tys. dol. W internecie sprzedają go za 40 dolarów,"Diagnoza nowotworu zmieniła życie Debbie Rhodes i jej męża w jednej chwili. Największy szok przyszedł jednak później, gdy okazało się, że bez odpowiedniego ubezpieczenia lek potrzebny do walki z chorobą może kosztować nawet kilkanaście tysięcy dolarów miesięc…","The cancer medicine in the pharmacy was supposed to cost PLN 15,000. hole. They sell it online for $40. A cancer diagnosis changed the lives of Debbie Rhodes and her husband in an instant. The biggest shock, however, came later when it turned out that without proper insurance, the medicine needed to fight the disease could cost up to several thousand dollars a month...","Medicina cancer in pharmacopolio sumptus putabatur PLN 15,000. foveam. Vendunt online pro $40. Diagnosis cancer vitam Debbie Rhodes et mariti in instanti mutavit. Maxima concussio tamen postea incidit cum sine assecurationis propriae evenit, medicinam, quae morbo certare opus erat, pluribus milibus dollariorum mense constant.","https://next.gazeta.pl/next/7,151003,32802040,lek-na-raka-w-aptece-mial-kosztowac-15-tys-dol-w-internecie.html","https://bi.im-g.pl/im/a9/48/1f/z32802217IER,Apteka---zdjecie-ilustracyjne.jpg",,"W Stanach Zjednoczonych ceny leków od lat budzą ogromne emocje. Dla wielu pacjentów różnice między aptekami są tak duże, że leczenie staje się walką nie tylko o zdrowie, ale też o oszczędności życia.… [+3702 chars]",,2026-05-31 08:26:15+00:00,random,,,
50cb20401c99dce248a01b15102d4b94,2026-05-21T12:23:33Z,Tropical Cyclone,lek,www.bankier.pl,pl,0.9,"Ein weiterer Łaganga-Stream startet. Der Schöpfer sammelt für Maks Spenden für das teuerste Medikament der Welt. Der Internetschöpfer Łagang gab bekannt, dass er eine weitere Spendenaktion starten wird. Während des Streams, der am Freitag um 16:00 Uhr beginnt, wird er mit dem Fahrrad von Südpolen nach Danzig fahren. All dies, um den kranken Maks zu unterstützen.",Rusza kolejny stream Łatwoganga. Twórca zbiera środki na najdroższy lek świata dla Maksa,"Twórca internetowy Łatwogang ogłosił, że rusza z kolejną zbiórką. Podczas streamu, który rozpocznie się w piątek o 16:00, dojedzie rowerem z południa Polski do Gdańska. Wszystko po to, aby wesprzeć chorego Maksa.","Another Łaganga stream is starting. The creator is raising funds for the most expensive medicine in the world for Maks. Internet creator Łagang announced that he is starting another fundraiser. During the stream, which will start on Friday at 4:00 p.m., he will ride a bicycle from southern Poland to Gdańsk. All this to support sick Maks.","Alius aganga rivus incipiens. Conditor medicinam pretiosam in mundo Maks levat pecunia. Interrete creator Łagang nuntiavit se alium fundraiser proficisci. Per rivum, qui Veneris die 4:00 a.m. incipiet, birotam a Polonia australi usque ad Gdańsk vehebit. baec omnia male alunt Maks.",https://www.bankier.pl/wiadomosc/Rusza-kolejny-stream-Latwoganga-Tworca-zbiera-srodki-na-najdrozszy-lek-swiata-dla-Maksa-9137146.html,https://galeria.bankier.pl/p/9/3/80b86f8a769894-948-569-10-46-1016-610.png,,"Twórca internetowy atwogang ogosi, e rusza z kolejn zbiórk. Podczas streamu, który rozpocznie si w pitek o 16:00, dojedzie rowerem z poudnia Polski do Gdaska. Wszystko po to, aby wesprze chorego Maks… [+1992 chars]",,2026-05-31 08:26:15+00:00,random,,,
e4b7767a7b8d2f33fa86917f8e32bb37,2026-05-26T10:55:08Z,Snow&Ice,kry,kopalniawiedzy.pl,pl,0.9,"Bereits im 15. Jahrhundert verwendeten chinesische Chirurgen Anästhetika. Eine außergewöhnliche Entdeckung von Archäologen aus China wirft ein neues Licht auf die Medizin der Ming-Dynastie und legt nahe, dass lokale Chirurgen bereits im 15. Jahrhundert über überraschend wirksame Schmerzmittel verfügten. Die soeben in der Antike veröffentlichten Forschungsergebnisse verknüpfen…",Już w XV wieku chińscy chirurdzy stosowali środki znieczulające,"Niezwykłe odkrycie archeologów z Chin rzuca nowe światło na medycynę dynastii Ming i sugeruje, że tamtejsi chirurdzy dysponowali zaskakująco skutecznymi środkami przeciwbólowymi już w XV wieku. Opublikowane właśnie na łamach Antiquity wyniki badań łączących a…",Chinese surgeons used anesthetics as early as the 15th century. An extraordinary discovery by archaeologists from China sheds new light on the medicine of the Ming dynasty and suggests that local surgeons had surprisingly effective painkillers already in the 15th century. The results of research just published in Antiquity linking…,Chinenses chirurgi anesthetici primo saeculo XV usi sunt. Incredibilis inventio ab archaeologis e Sinis novam lucem medicinam dynastiae Ming fundit et chirurgos locales mirae efficacia pharmacopolas iam saeculo XV suggerit. Proventus investigationis in Antiquitate conjunctionis nuper editae...,"https://kopalniawiedzy.pl/chirurg-Chiny-srodek-znieczulajacy-tojad,38671",https://kopalniawiedzy.pl/media/lib/642/miingnozyczki1-0f6f4ba4fec60c84be185ae6356ec43a.jpg,,"Niezwyke odkrycie archeologów z Chin rzuca nowe wiato na medycyn dynastii Ming i sugeruje, e tamtejsi chirurdzy dysponowali zaskakujco skutecznymi rodkami przeciwbólowymi ju w XV wieku. Opublikowane … [+5844 chars]",,2026-05-31 08:26:15+00:00,random,,,
4dfb3ed80baed07e4e1c145e29f0a3cf,2026-05-28T16:16:26Z,Tropical Cyclone,lek,geekweek.interia.pl,pl,0.9,Sie entdeckten ein bahnbrechendes Medikament gegen Hepatitis B. Es gibt 240 Millionen Patienten Hoffnung. Wissenschaftler veröffentlichten heute (28. Mai) die Ergebnisse klinischer Phase-III-Studien mit dem Medikament Bepirovirsen. Ihre Erkenntnisse geben Hoffnung auf eine „funktionelle Heilung“ einer chronischen Hepatitis-B-Virusinfektion. Halbjährige Behandlung zusätzlich zu den Standardmedikamenten…,Odkryli przełomowy lek na WZW B. Daje nadzieję 240 mln chorych,"Naukowcy opublikowali dziś (28 maja) wyniki badań klinicznych III fazy nad lekiem bepirovirsen. Ich odkrycia dają nadzieję na ""funkcjonalne wyleczenie"" przewlekłego wirusowego zapalenia wątroby typu B (WZW B). Półroczna kuracja dodana do standardowych leków p…","They discovered a breakthrough drug for hepatitis B. It gives hope to 240 million patients. Scientists published today (May 28) the results of phase III clinical trials of the drug bepirovirsen. Their findings provide hope for a ""functional cure"" of chronic hepatitis B virus infection. Half-year treatment added to standard medications…","Medicamentum rupturae hepatitis repertum B. Dat spem ad CCXL decies centena millia aegris. Scientistae hodie editi (28 Maii) eventus Paschae III iudiciis clinicis medicamentorum bepirovirsen. Inventiones eorum spem praebent ""curae functionis"" longi infectio virium hepatitis B. Dimidium annorum curatio vexillum medicamenta addita sunt…","https://geekweek.interia.pl/medycyna/news-przelom-w-walce-z-wzw-b-bepirovirsen-wyleczyl-funkcjonalnie,nId,23489055",https://i.iplsc.com/-/000AZ9ZRV0BM5TRC-C461.jpg,,"W skrócie
<ul><li>
Wyniki bada klinicznych III fazy nad lekiem bepirovirsen odkrywaj przeomow moliwo funkcjonalnego wyleczenia przewlekego wirusowego zapalenia wtroby typu B u wybranej grupy pacjen… [+7503 chars]",,2026-05-31 08:26:15+00:00,random,,,
373f0a07249dc1989c8612a9929bcb67,2026-05-29T05:57:16Z,Snow&Ice,kry,wydarzenia.interia.pl,pl,0.9,"Das millionenschwere Medikament ist in Europa nicht zugelassen. Im Hintergrund versammelt sich Łaganga. Piotr Hancke, bekannt als Łagang, sammelte erneut Geld für die Behandlung von Kindern, die dieses Mal an Duchenne-Muskeldystrophie (DMD) litten. Die Therapie kostet über 15 Mio. PLN und die Eltern müssen die Kosten selbst tragen, der Löwenanteil davon ist…","Lek za miliony, nie jest w Europie dopuszczony. W tle zbiórka Łatwoganga","Piotr Hancke, znany jako Łatwogang, ponownie zbierał pieniądze na leczenie dzieci, tym razem chorujących na dystrofię mięśniową Duchenne'a (DMD). Za terapię trzeba zapłacić ponad 15 milionów złotych, a rodzice sami muszą pokryć wydatki, z których lwia część t…","The drug, worth millions, is not approved in Europe. Łaganga's gathering in the background. Piotr Hancke, known as Łagang, once again raised money for the treatment of children, this time suffering from Duchenne muscular dystrophy (DMD). The therapy costs over PLN 15 million, and parents have to cover the expenses themselves, the lion's share of which is…","Medicamentum, pretium decies, in Europa non probatur. Łaganga in curriculo colligens. Piotr Hancke, cognomento agang, pecuniam pro curatione infantium iterum erexit, hoc tempore dystrophy musculari Duchenne laborans (DMD). De curatione super PLN 15 miliones, et parentes habent ad expensas ipsas, quarum participes leonis est….","https://wydarzenia.interia.pl/kraj/news-lek-za-miliony-nie-jest-w-europie-dopuszczony-w-tle-zbiorka,nId,23489197",https://i.iplsc.com/-/000MUSDV3JHVW09B-C461.jpg,,"W skrócie
<ul><li>
Piotr Hancke, znany jako atwogang, prowadzi zbiórk na terapi genow dla chopców z dystrofi miniow Duchennea.
</li><li>
Lek nie uzyska pozwolenia na dopuszczenie do obrotu w Euro… [+3190 chars]",,2026-05-31 08:26:15+00:00,random,,,
28935ba3f0e401fa02aaa251330c6a37,2026-05-29T16:00:02Z,Tropical Cyclone,lek,antyweb.pl,pl,0.9,"Lassen Sie die polnischen Universitäten aufhören, etwas vorzutäuschen. Künstliche Intelligenz ist nicht nur eine „Abkürzung“. Wenn Wissenschaftler künstliche Intelligenz nutzen, um ein neues Medikament zu entwickeln: Alle applaudieren. Aber wenn jemand damit zumindest einen Teil der Bewerbung macht: Die Zuschauerbox „surrt“ laut. Was ist mit Studenten? Seien wir ehrlich, sie nutzen es auch. Aber ist es hauptsächlich für...","Niech polskie uczelnie przestaną udawać. Sztuczna inteligencja to nie tylko ""droga na skróty""","Gdy naukowcy z pomocą sztucznej inteligencji opracują nowy lek: wszyscy klaszczą. Ale gdy ktoś zrobi sobie z jej pomocą choćby część aplikacji: loża publiczności donośnie ""buczy"". A co ze studentami? Nie oszukujmy się, też jej używają. Ale czy głównie do zast…","Let Polish universities stop pretending. Artificial intelligence is not just a ""shortcut"". When scientists use artificial intelligence to develop a new drug: everyone applauds. But when someone uses it to make at least part of the application: the audience box ""buzzes"" loudly. What about students? Let's face it, they use it too. But is it mainly for…","Desinant universitates Poloniae simulare. Intelligentia artificialis non solum est ""brevis"". Cum scientiarum artificialium intellegentiae utuntur ad novum medicamentum explicandum: omnes plaudunt. Sed cum quis utitur ea ut saltem partem applicationis adhibeat: thecam ""stridit"" clare audientium. Quid de discipulis? Praestet, utantur etiam. Sed estne maxime...",https://antyweb.pl/sztuczna-inteligencja-uczelnie-2026,"https://static.antyweb.pl/img/w_1250,h_550/wp-content/uploads/2026/05/nauka-1.jpeg",,"Za moich czasów takich rzeczy nie byo: i moe szkoda, bo nawet po ustnym, poprawkowym egzaminie z teorii spoecznych u wyjtkowo upierdliwego nauczyciela (który zdaem jako ostatni), nie bardzo cokolwiek… [+10445 chars]",,2026-05-31 08:26:15+00:00,random,,,
5f1ce29977daf880ac90a021e079bfb5,2026-05-30T06:30:01Z,Snow&Ice,kry,geekweek.interia.pl,pl,0.9,"Eine neue Entdeckung erklärt, wie Vögel navigieren. Sie haben einen Kompass in ihrer Leber. Wie spüren Zugvögel und Brieftauben das Erdmagnetfeld, um sich in der Abwesenheit der Sonne zurechtzufinden? Die Frage nach dem Wesen der Magnetorezeption ist seit Jahren eines der größten Rätsel der Biologie. Die neueste Studie, die in der renommierten Fachzeitschrift veröffentlicht wurde…","Nowe odkrycie wyjaśnia, jak nawigują ptaki. Mają kompas w wątrobie","W jaki sposób ptaki wędrowne i gołębie pocztowe wyczuwają pole magnetyczne Ziemi, by nawigować przy braku Słońca? Pytanie o istotę magnetorecepcji od lat stanowiło jedną z największych zagadek biologii. Najnowsze badanie opublikowane w prestiżowym czasopiśmie…",A new discovery explains how birds navigate. They have a compass in their liver. How do migratory birds and homing pigeons sense the Earth's magnetic field to navigate in the absence of the Sun? The question about the essence of magnetoreception has been one of the greatest mysteries of biology for years. The latest study published in the prestigious journal…,Nova inventio exponit quomodo navigant aves. Circuiunt in jecore suo. Quomodo aves migratoriae et columbae hominges magneticum Telluris campum in absentia Solis navigare sentiunt? Quaestio de essentia magnetoreceptionis unum ex maximis mysteriis biologiae annis fuit. Aliquam studium in praestantia ephemeride…,"https://geekweek.interia.pl/przyroda/news-jak-ptaki-wyczuwaja-pole-magnetyczne-naukowcy-odkryli-kompas,nId,23489468",https://i.iplsc.com/-/000KEC6HWJY7545D-C461.jpg,,"W skrócie
<ul><li>
Wedug najnowszych bada w czasopimie ""Science"" wystpujce w wtrobie makrofagi bogate w elazo mog peni rol wewntrznego kompasu u gobi pocztowych, ptaków wdrownych i innych zwierzt.… [+6858 chars]",,2026-05-31 08:26:15+00:00,random,,,
66257412587f14cbd8a910dddf4f420f,2026-05-29T18:43:00Z,Precipitation,front atmosferyczny,wiadomosci.gazeta.pl,pl,0.8,"Stürme und Regenfälle kommen nach Polen. IMWM gab Warnungen heraus. Nach Angaben des Instituts für Meteorologie und Wasserwirtschaft wird Polen in den kommenden Tagen unter dem Einfluss der Tiefdruckbucht aus Südschweden stehen, wobei sich eine kalte atmosphärische Front langsam vom Westen in die Landesmitte bewegt. Die Wärme wird weiter fließen...",Do Polski nadciągają burze i opady deszczu. IMGW wydał ostrzeżenia,"Jak informuje Instytut Meteorologii i Gospodarki Wodnej, w najbliższych dniach Polska będzie pod wpływem zatoki niżu znad południowej Szwecji z chłodnym frontem atmosferycznym przemieszczającym się powoli z zachodu ku centrum kraju. Napływać będzie nadal ciep…","Storms and rainfall are coming to Poland. IMWM issued warnings. According to the Institute of Meteorology and Water Management, in the coming days Poland will be under the influence of the bay of low pressure from southern Sweden with a cold atmospheric front moving slowly from the west to the center of the country. Warmth will continue to flow...","Tempestates et pluviae in Poloniam veniunt. IMWM monuisse. Secundum Institutum Meteorologicum et Procuratio Aquarum, in diebus adventus Polonia sub influxu sinus humilitatis pressionis ex Suetia meridionali cum fronte atmosphaerica frigida lente ab occidente in centrum terrae movebitur. Calor permanebit influere...","https://wiadomosci.gazeta.pl/pogoda-i-klimat/7,198071,32823661,do-polski-nadciagaja-burze-i-opady-deszczu-imgw-wydal-ostrzezenia.html","https://bi.im-g.pl/im/79/4d/1f/z32823673IER,Burza--zdjecie-ilustracyjne-.jpg",,"W sobot (30 maja) w Polsce bdzie zachmurzenie due z wikszymi przejanieniami, na wschodzie pocztkowo, a po poudniu na zachodzie, take rozpogodzenia. Wystpi przelotne opady deszczu przemieszczajce si o… [+2029 chars]",,2026-06-01 05:24:21+00:00,random,,,
fbb158a4b0c3a18ca4c0a654f711b229,2026-05-26T12:14:59Z,Wildfire,pożar,wydarzenia.interia.pl,pl,0.9,"Wälder könnten wieder brennen. Eine große Bedrohung in den meisten Teilen Polens. In den Wäldern kann es gefährlich sein. Bei warmem und trockenem Wetter ist die Brandgefahr vielerorts sehr hoch. Dies gilt unter anderem für die südliche Region Lublin, wo Anfang Mai ein komplizierter Brandbekämpfungseinsatz durchgeführt wurde. Bedingungen am Mittwoch...",Lasy znowu mogą zapłonąć. Duże zagrożenie w większości Polski,"W lasach może być niebezpiecznie. Ciepła i sucha pogoda sprawia, że zagrożenie pożarowe w wielu miejscach jest bardzo wysokie. Dotyczy to między innymi południowej Lubelszczyzny, gdzie na początku maja trwała skomplikowana akcja gaśnicza. Warunki w środę się …","Forests may burn again. A big threat in most of Poland. It can be dangerous in the forests. Warm and dry weather means that the fire risk is very high in many places. This applies, among others, to the southern Lublin region, where a complicated fire-fighting operation was carried out at the beginning of May. Conditions on Wednesday...","Silvae iterum exurant. Magna comminatio in plerisque Poloniae. In silvis periculosum esse potest. Calidum et siccitatem significat periculum ignis in multis locis altissimum esse. Id, inter alios, ad regionem Lublinensem meridionalem, ubi vario pugnarum ignium operatio ineunte Maio peracta est. Condiciones die mercurii...","https://wydarzenia.interia.pl/kraj/news-rosnie-zagrozenie-w-lasach-rowniez-tam-gdzie-juz-pracowali-s,nId,23487765",https://i.iplsc.com/-/000MUFSO16RCDWHN-C461.jpg,,"Na pocztku maja setki straaków walczyy z gronym poarem Puszczy Solskiej na Lubelszczynie. W pewnym momencie pomoga im pogoda, przynoszc w t okolic deszcze, dziki którym atwiej byo ugasi wysuszony las… [+2423 chars]",,2026-06-01 05:24:21+00:00,random,,,
19397bd8e3098fb2a2c06b3109cef935,2026-05-06T15:44:20Z,Storm,burza,tvn24.pl,pl,0.7,"Eigentlich sollte es eine günstige Kantine werden, aber es entstand eine Premium-Food-Halle. Sturm über den neuen Räumlichkeiten der Universität Warschau. Der Rektor versprach ein öffentliches Lokal, der private Mieter entschied sich für einen Loft-Stil und moderne Technik. Wir besuchten die neue Gastronomieeinrichtung der Universitätsbibliothek, um herauszufinden, warum aus einem Ort, der eigentlich Studierende unterstützen sollte, ein…","Miała być tania stołówka, powstał premium food hall. Burza wokół nowego lokalu na UW","Rektor obiecywał ogólnodostępną jadłodajnię, prywatny najemca postawił na loftowy styl i nowoczesne technologie. Odwiedziliśmy nowy lokal gastronomiczny w Bibliotece Uniwersyteckiej, by sprawdzić, dlaczego miejsce, które miało wspierać studentów, stało się sy…","It was supposed to be a cheap canteen, but a premium food hall was created. Storm over the new premises at the University of Warsaw. The rector promised a public eatery, the private tenant opted for a loft style and modern technologies. We visited the new catering facility at the University Library to check why a place that was supposed to support students became a…","Putabatur vilis utrem esse, sed aula premium cibi creatum est. Tempestas nova praemissorum apud universitatem Varsaviae. Rector publicus eatery promissus, tabulatum stilo et technologiae modernae possessor privatus optavit. Novam facultatem praebendi in Bibliotheca Universitatis visitavimus ad reprimendam cur locus, qui studentibus favere putabatur, factus est...",https://tvn24.pl/tvnwarszawa/srodmiescie/warszawa-burza-wokol-nowej-stolowki-na-uw-studenci-czekali-na-tanie-posilki-dostali-premium-food-hall-st9034147,https://tvn24.pl/_e/i/tvnwarszawa/najnowsze/cdn-zdjecie-6824117-buwbar-nowa-przestrzen-gastronomiczna-na-uniwersytecie-warszawskim-ph9034131/alternates/WEBP_LANDSCAPE_840,,"Miaa by tania stoówka, powsta premium food hall. Burza wokó nowego lokalu na UW
Rektor obiecywa ogólnodostpn jadodajni, prywatny najemca postawi na loftowy styl i nowoczesne technologie. Odwiedzilim… [+10798 chars]",,2026-06-01 10:38:30+00:00,random,,,
