index,published,topic,term,domain,language,valid,de,title,description,en,la,url,image,archive,content,quote,added,feed,country,ipcc,continent
18a338677ca363719073e9ca20f205b3,2026-05-25T06:59:08Z,Flood,powódź w Australii,wiadomosci.wp.pl,pl,0.3,"Jeden Tag kommt es zu einem brutalen Kälteeinbruch. Die Temperatur sinkt auf 14 Grad Celsius. Eine Woche voller plötzlicher Wetterumschwünge liegt vor uns. Karten des Instituts für Meteorologie und Wasserwirtschaft (IMGW) zeigen, dass es nach den Auswirkungen sehr warmer Luftmassen am Dienstag zur Wochenmitte zu einem drastischen Temperaturabfall kommen wird. Bewohner von halb…",Lada dzień brutalne ochłodzenie. Temperatura spadnie do 14 st. C,"Przed nami tydzień pełen gwałtownych zwrotów akcji w pogodzie. Z map Instytutu Meteorologii i Gospodarki Wodnej (IMGW) wynika, że po wtorkowym uderzeniu bardzo ciepłych mas powietrza, połowa tygodnia przyniesie drastyczne tąpnięcie temperatury. Mieszkańcy pół…","A brutal cold snap is coming any day now. The temperature will drop to 14 degrees Celsius. A week full of sudden changes in the weather ahead of us. Maps from the Institute of Meteorology and Water Management (IMGW) show that after Tuesday's impact of very warm air masses, mid-week will bring a drastic drop in temperature. Residents of half…","Inhumanum frigus aliquo die iam frangitur. Temperatura ad 14 gradus Celsius decidet. Septimana plena subitarum mutationum in tempestate nos antecessit. Tabulae ab Instituto Meteorologico et Procuratio Aquarum (IMGW) ostendunt post impulsum Martis missarum aeris calidissimae, media septimana guttam acrem in temperie afferet. Residentibus dimidium…",https://wiadomosci.wp.pl/lada-dzien-brutalne-ochlodzenie-temperatura-spadnie-do-14-st-c-7289615758424160a,https://v.wpimg.pl/MjQ3Yjc3YgswUS9ZTEhvHnMJewMKEWFIJBFjSEwCf15hS25cUxwrAz1WKw8TXGMNI0YpCxRDYxo9HDgaChw7W35XMBkTXywTflY0CAZXYlhnBGAOU1V0R2JSaw5OBy5aZR5hCFcBYFhoAmteVFF6XTULPUge,,"Sprawd prognoz pogody dla swojego regionu na POGODA.WP.PL
Wtorkowe uderzenie ciepa przed zaamaniem pogody
Zanim jednak dotrze do nas potne ochodzenie, tydzie rozpocznie si niezwykle obiecujco. Poni… [+3450 chars]",,2026-05-26 08:48:25+00:00,wmo,Australia,CAU,Oceania
63e3d1411dc65a02face9d8ed30cb897,2026-05-02T14:30:01Z,Snow&Ice,lodowa Brazylia,wydarzenia.interia.pl,pl,0.3,"Regensteuer 2026. Für wen gilt sie und wie hoch ist sie? Die seit 2018 in Polen geltende Regensteuer ist eine Gebühr, die von Eigentümern großflächiger Grundstücke erhoben wird. Seine Menge im Jahr 2026 hängt vom Grad der Bodenversiegelung und den verwendeten Retentionslösungen ab. Wer muss bezahlen und…",Podatek od deszczu 2026. Kogo dotyczy i ile wynosi?,"Podatek od deszczu, obowiązujący w Polsce od 2018 roku, jest opłatą nakładaną na właścicieli nieruchomości o dużych powierzchniach. Jego wysokość w 2026 roku zależy od stopnia uszczelnienia gruntu oraz zastosowanych rozwiązań retencyjnych. Kto musi zapłacić i…","Rain tax 2026. Who does it apply to and how much is it? The rain tax, in force in Poland since 2018, is a fee imposed on owners of large-area properties. Its amount in 2026 depends on the degree of soil sealing and the retention solutions used. Who has to pay and…","Pluviis tributum 2026. Quis hoc refert et quantum est? Vectigal pluviae, in Polonia vigente ab anno 2018, feodum impositum est dominis possessionibus magnae areae. Eius moles anno 2026 pendet a gradu solii signandi et solutionum retentio adhibitorum. Quis solvere et…","https://wydarzenia.interia.pl/kraj/news-podatek-od-deszczu-2026-kogo-dotyczy-ile-wynosi-i-jak-unikna,nId,23470310",https://i.iplsc.com/-/000MPQQIJR8VPWHO-C461.jpg,,"Spis treci:
<ol><li>Dla kogo podatek od deszczu 2026?
</li><li>Ile wynosi podatek od deszczu 2026?
</li><li>Co obejmuje podatek od deszczu?
</li></ol>
Podatek od deszczu to potoczne okrelenie op… [+3953 chars]",,2026-05-26 13:27:20+00:00,wmo,Brazil,SAM,South-America
d20839263930aa189d228a9ff89d7a1a,2026-05-05T06:42:52Z,Storm,wezbranie sztormowe województwo mazowieckie powiat płoński,kobieta.interia.pl,pl,0.3,"Die afrikanische Hitze nähert sich Polen. Die Thermometer zeigen 34 Grad C an. Vieles deutet darauf hin, dass sich in Polen das Frühlingswetter endgültig eingependelt hat. Auch wenn die Temperaturen in den kommenden Tagen leicht sinken werden, dürften wir in diesem Jahr wohl schon bald das erste heiße Wetter erleben. Was ist sonst noch mit dem Wetter los?",Do Polski zbliża się afrykański żar. Termometry wskażą 34 st. C,"Wiele wskazuje na to, że wiosenna aura na dobre zadomowiła się w Polsce. Choć w najbliższych dniach temperatura nieco spadnie, to prawdopodobnie niebawem doświadczymy pierwszych w tym roku upałów. Co jeszcze słychać w pogodzie?","African heat is approaching Poland. Thermometers will show 34 degrees C. There are many indications that the spring weather has settled in Poland for good. Although the temperature will drop slightly in the coming days, we will probably soon experience the first hot weather this year. What else is going on with the weather?","Africae calor Poloniam appropinquat. Thermometrae 34 gradus ostendent C. Multa indicia sunt tempestates vernae in Polonia ad bonum constitisse. Etsi temperatura leviter in adventus dies decidet, mox verisimiliter primum aestus hoc anno experiemur. Quid aliud cum tempestate agatur?","https://kobieta.interia.pl/newsy/news-upal-nadciaga-nad-polske-prognozuja-konkretne-dni-nawet-34-s,nId,23472659",https://i.iplsc.com/-/000LC61T7J2RLQWE-C461.jpg,,"Jaka bdzie pogoda w najbliszych dniach?
We wtorek w zachodniej i pónocnej poowie Polski zachmurzenie przewanie due, ale lokalnie naley spodziewa si wikszych przejanie. Nad reszt kraju na ogó zachmur… [+3515 chars]",,2026-05-26 18:09:43+00:00,wmo,Poland,WCE,Europe
1c92fc09796204241ad85e94de1c1b31,2026-05-12T21:36:02Z,Heat Wave,fala upałów w polsce,natemat.pl,pl,0.7,"Eine Hitzewelle ist unvermeidlich. Die Wettervorhersage für Mai ist nur eine Einführung. Langfristige Modelle deuten auch darauf hin, dass der Sommer 2026 außergewöhnlich heiß sein könnte. Nach einem kalten Anfang Mai und IMWM-Warnungen vor Frost wird sich das Wetter in Polen spürbar ändern. Meteorologen sagen eine allmähliche Erwärmung voraus, und am Ende des Monats ...",Fala upałów jest nieunikniona. Prognoza pogody na maj to tylko wstęp,"Długoterminowe modele wskazują też, że lato 2026 może należeć do wyjątkowo gorących. Po chłodnym początku maja i ostrzeżeniach IMGW przed przymrozkami pogoda w Polsce zacznie się wyraźnie zmieniać. Synoptycy prognozują stopniowe ocieplenie, a pod koniec miesi…","A heat wave is inevitable. The weather forecast for May is only an introduction. Long-term models also indicate that summer 2026 may be exceptionally hot. After a cold beginning of May and IMWM warnings about frost, the weather in Poland will start to change noticeably. Forecasters predict gradual warming, and at the end of the month…","A calor unda est inevitabilis. Tempestas praenuntientur pro Maio tantum introductio. Exempla diuturnum etiam indicant aestatem 2026 eximie calidam esse. Post frigidum initium Maii et IMWM monita de gelu, tempestas in Polonia notabiliter mutare incipiet. Praedicunt calefactionem gradatim Forecasters, et in fine mensis ...","https://natemat.pl/653128,fala-upalow-jest-nieunikniona-prognoza-pogody-na-maj-to-tylko-wstep","https://m.natemat.pl/3c159bb2e3664582d907e710e9ad403b,1920,1080,0,0.webp",,"IMGW opublikowao nowe prognozy pogody dla Polski. Po okresie chodów i lokalnych przymrozków czeka nas dynamiczne ocieplenie. Do czerwca moemy liczy na ciep, agodn aur. Póniej pogoda moe zgotowa nam p… [+14 chars]",,2026-05-26 18:09:43+00:00,wmo,Poland,WCE,Europe
e923ee4499956fe7a167a190fe8c52c3,2026-05-04T09:57:09Z,Heat Wave,fala upałów,wiadomosci.wp.pl,pl,0.9,"33 Grad im Schatten. Eine Hitzewelle kommt nach Polen. Die langfristige Prognose für die erste Maihälfte kündigt große und plötzliche Veränderungen an. Nach einer vorübergehenden, tiefen Abkühlung, die uns an den launischen Frühling erinnern wird, erwartet uns plötzlich ein Sommereinbruch. Mitte nächster Woche kommt es zu extremen…",33 stopnie w cieniu. Do Polski sunie fala upałów,"Prognoza długoterminowa na pierwszą połowę maja zapowiada potężne i gwałtowne zmiany. Po przejściowym, głębokim ochłodzeniu, które przypomni nam o kapryśnej wiośnie, czeka nas gwałtowne uderzenie lata. W połowie przyszłego tygodnia do Polski wleje się ekstrem…","33 degrees in the shade. A heat wave is coming to Poland. The long-term forecast for the first half of May announces huge and sudden changes. After a temporary, deep cooling that will remind us of the capricious spring, we will have a sudden burst of summer. In the middle of next week, extreme…","33 gradus in umbra. Fluctus aestus in Poloniam venit. Diu terminus praesagio primae dimidiae Maii denuntiat ingentes et subitas mutationes. Post tempus, profunda refrigeratio, quae nos volubilitatem veris admonebit, subito aestatem erumpemus. In media septimana proxima, extrema...",https://wiadomosci.wp.pl/33-stopnie-w-cieniu-do-polski-sunie-fala-upalow-7282218897778752a,https://v.wpimg.pl/NmY5NjJjYQw4VzhZZRFsGXsPbAMjSGJPLBd0SGVbfFlpTXlcekUoBDVQPA86BWAKK0A-Cz0aYB01Gi8aI0U4XHZRJxk6Bi8UdlAjCC8OYQtvVy9Sc156QGkDKAtnXnoIOxh3CCtZY1k8UHgMc1x8DjpTe0g3,,"Sprawd prognoz pogody dla swojego regionu na POGODA.WP.PL.
Jeszcze w tym tygodniu musimy przygotowa si na spadki temperatur. Mapy maksymalnej temperatury powietrza wyranie pokazuj, e jeszcze midzy 6… [+3653 chars]",,2026-05-26 18:09:43+00:00,random,,,
e962067d9b58640879582bcd349876ce,2026-05-06T10:30:07Z,Thunderstorm,burza,antyweb.pl,pl,0.7,"Sturm um Otodom. Das Amt für Wettbewerbs- und Verbraucherschutz untersucht umstrittene Änderungen. Das Amt für Wettbewerbs- und Verbraucherschutz prüft, ob Änderungen in der Gebührenberechnung für Immobilienagenturen in Otodom gegen das Gesetz verstoßen. Sollten sich die Verdachtsmomente bestätigen, droht der beliebten Plattform ein hohes Bußgeld.",Burza wokół Otodom. UOKiK bada kontrowersyjne zmiany,"UOKiK sprawdza, czy zmiany w naliczaniu opłat dla biur nieruchomości na Otodom nie naruszają prawa. Jeśli podejrzenia się potwierdzą, to nad popularna platformą pojawi się widmo wysokiej kary.","Storm around Otodom. The Office of Competition and Consumer Protection is investigating controversial changes. The Office of Competition and Consumer Protection is checking whether changes in the calculation of fees for real estate agencies in Otodom violate the law. If the suspicions are confirmed, the specter of a heavy fine will appear over the popular platform.","Tempestas circa Otodom. Officium Competitionis et Consumer Protectionis quaerit mutationes controversiae. Officium Competitionis et Consumer Protectionis inhibet num mutationes in calculi mercedum pro institutionibus realibus in Otodom legem violant. Si suspiciones confirmentur, larvus gravis subtilis in populari suggestu apparebit.",https://antyweb.pl/burza-wokol-otodom-uokik-bada-kontrowersyjne-zmiany,"https://static.antyweb.pl/img/w_1250,h_550/wp-content/uploads/2026/05/45934253_S.jpg",,"Otodom najbardziej rozpoznawalny portal z nieruchomociami na polskim rynku zmieni zasady naliczania opat dla biur nieruchomoci, wywoujc przy tym mnóstwo kontrowersji. Podmioty od lat wspópracujce z O… [+3119 chars]",,2026-05-26 22:02:37+00:00,random,,,
4c536f43dd70024ea22470437fc0cce3,2026-05-18T07:32:59Z,Thunderstorm,burza,wiadomosci.wp.pl,pl,0.7,"Sturm nach Eingreifen von Sakiewicz. „Erklären Sie es weiter unten.“ -Die Polizei hat im Fall von Tomasz Sakiewicz ungeschickt gehandelt - sagte Janusz Cieszyński in der Sendung „Tłit“ von Wirtualna Polska. Zu dem lautstarken Eingreifen in der Wohnung des Chefredakteurs von Republika TV meinte er, die Situation müsse „durch...“ geklärt werden.","Burza po interwencji u Sakiewicza. ""Wyjaśnić do spodu""","-Policja zadziałała w sprawie Tomasza Sakiewicza w sposób nieudolny - stwierdził Janusz Cieszyński w programie ""Tłit"" Wirtualnej Polski. Komentując głośną interwencję w mieszkaniu naczelnego telewizji Republika, stwierdził, że sytuacja musi być wyjaśniona ""do…","Storm after Sakiewicz's intervention. ""Explain below."" -The police acted ineptly in the case of Tomasz Sakiewicz - said Janusz Cieszyński in the ""Tłit"" program of Wirtualna Polska. Commenting on the loud intervention in the apartment of the editor-in-chief of Republika TV, he said that the situation must be clarified ""by...","Tempestas post interventum Sakiewicz. ""Expone infra."" - Vigiles in causa Tomasz Sakiewicz inepte egerunt - dixit Janusz Cieszyński in ""Tłit"" programmate Wirtualna Polska. De magna interventu in diaetam editoris principis Republika TV commentans, dixit condicionem declarandam esse ""per...",https://wiadomosci.wp.pl/burza-po-interwencji-u-sakiewicza-wyjasnic-do-spodu-7287131013317697v,https://v.wpimg.pl/Y2UyODgudlM0Gzl3SA57RndDbS0OV3UQIFt1ZkhEawZlAXhyV1ouQiEPYjEXGTZTMVQuNA5bLkI2HSFqFxl2UDZNKSFfED8fbEt8IUpBYQEwVHYhU0d0UDNILSZXEDpXZ0F3ag0FPhAo,,"-Policja zadziaaa w sprawie Tomasza Sakiewicza w sposób nieudolny - stwierdzi Janusz Cieszyski w programie ""Tit"" Wirtualnej Polski. Komentujc gon interwencj w mieszkaniu naczelnego telewizji Republik… [+2420 chars]",,2026-05-26 22:02:37+00:00,random,,,
0ee7cb5876813c6006b70be6dca4c70f,2026-05-23T17:07:55Z,Thunderstorm,burza,wiadomosci.wp.pl,pl,0.7,"Sturm nach dem Skandal bei Morskie Oko. Die Polizei reagiert. Nachdem ein lautstarker Sportwagen in die Gegend von Morskie Oko gefahren ist, kündigt die Polizei härtere Konsequenzen für den ukrainischen Influencer an. Nach der Analyse von Materialien aus dem Internet führen die Beamten weitere Aktivitäten durch und stellen einen Antrag auf ein Einreiseverbot für Polen und die Zone...",Burza po skandalu nad Morskim Okiem. Policja reaguje,Po głośnym wjeździe sportowym autem w rejon Morskiego Oka policja zapowiada ostrzejsze konsekwencje dla ukraińskiego influencera. Po analizie materiałów z internetu funkcjonariusze prowadzą dodatkowe czynności i złożyli wniosek o zakaz wjazdu do Polski i stre…,"Storm after the scandal at Morskie Oko. The police respond. After a loud sports car drove into the Morskie Oko area, the police announce tougher consequences for the Ukrainian influencer. After analyzing materials from the Internet, the officers carry out additional activities and submitted an application for a ban on entry to Poland and the zone...","Tempestas post scandalum in Morskie Oko. Vigiles respondere. Postquam currus magno ludis in area Morskie Oko compulerunt, magistratus nuntiant eventus duriores pro influxu Ucrainae. Postquam materias ex Interrete resolventes, duces additas actiones exercent et applicationem pro banno in Poloniam et zonam ingressu.",https://wiadomosci.wp.pl/burza-po-skandalu-nad-morskim-okiem-policja-reaguje-7289057987754080a,https://v.wpimg.pl/MzNhNTQxYhsvCjhnfgNvDmxSbD04WmFYO0p0dn5Jf05-EHliYVcrEyINPDEhF2MdPB0-NSYIYwoiRy8kOFc7S2EMJychFCwDYQ0jNjQcYkp4Xi9lN08pV3cMejd8THVIfEV2YDQcYB4vXX1nME15S3tZe3Ys,,"Pobieranie, zwielokrotnianie, przechowywanie lub jakiekolwiek inne wykorzystywanie treci dostpnych w niniejszym serwisie - bez wzgldu na ich charakter i sposób wyraenia (w szczególnoci lecz nie wyczn… [+868 chars]",,2026-05-26 22:02:37+00:00,random,,,
c5a9920c6c174325e85fef16bc39621a,2026-05-05T22:55:39Z,Precipitation,burza,wiadomosci.wp.pl,pl,0.9,"„Du bist ein schrecklicher Heuchler.“ Sturm nach Mentzens Worten über General Kukula. Nachdem Sławomir Mentzen den Generalstabschef der polnischen Armee, General Wiesław Kukuła, angegriffen hatte, brach in den sozialen Medien eine Welle der Kritik gegen den Politiker aus. Seine Worte wurden von Vertretern verschiedener Optionen sowohl aus dem herrschenden Lager als auch aus der Opposition verurteilt, unter anderem auch …","""Jesteś strasznym hipokrytą"". Burza po słowach Mentzena o gen. Kukule","Po tym, jak Sławomir Mentzen uderzył w szefa Sztabu Generalnego WP gen. Wiesława Kukułę, w mediach społecznościowych na polityka spadła fala krytyki. Jego słowa potępili przedstawiciele różnych opcji, zarówno z obozu rządzącego, jak i opozycji, a także m.in. …","""You are a terrible hypocrite."" Storm after Mentzen's words about General Kukula. After Sławomir Mentzen attacked the Chief of the General Staff of the Polish Army, General Wiesław Kukuła, a wave of criticism fell on the politician on social media. His words were condemned by representatives of various options, both from the ruling camp and the opposition, as well as, among others, …","« Horribilis es hypocrita ». Storm post verba Mentzen de Kukula General. Post Sławomir Mentzen principem Staff Exercitus Poloniae, Generalis Wiesław Kukuła, invasit, fluctus reprehensionis in politicis instrumentis socialibus incidit. Verba eius varia per legatos damnata sunt, tum ex castris regendis et repugnantibus, tum inter alios.",https://wiadomosci.wp.pl/jestes-strasznym-hipokryta-burza-po-slowach-mentzena-o-gen-kukule-7282772506634272a,https://v.wpimg.pl/Y2RlOTAzdlMzDjlnbgF7RnBWbT0oWHUQJ051dm5LawZiFHhicVU_Wz4JPTExFXdVIBk_NTYKd0I-Qy4kKFUvA30IJicxFjhLfQkiNiQedgplWXZiJUs4H2FdKTJsTmgCN0EuZHNCdAVqVSwwJENpAWdcdnY8,,"Sowa, które Sawomir Mentzen wypowiedzia podczas wtorkowego spotkania z wyborcami w Elblgu, bardzo szybko poniosy si po mediach spoecznociowych. Lider Nowej Nadziei skomentowa w nich wypowied szefa Sz… [+4543 chars]",,2026-05-26 22:02:37+00:00,random,,,
be4f6104e49e955869a21957542b61fc,2026-05-19T03:45:13Z,Precipitation,burza,antyweb.pl,pl,0.9,Unglaublicher Sturm um Netflix-Neuerscheinungen. Diese Serie weckt extreme Emotionen. Extrem positive und extrem negative Bewertungen – die neue Netflix-Serie spaltet die Zuschauer.,Niewiarygodna burza wokół nowości Netflixa. Ten serial budzi skrajne emocje,Skrajnie pozytywne i skrajnie negatywne oceny - nowy serial Netflixa podzielił widzów.,Unbelievable storm around Netflix new releases. This series evokes extreme emotions. Extremely positive and extremely negative ratings - the new Netflix series has divided viewers.,Incredibilis tempestas circum Netflix novas emittit. Haec series extremas affectiones evocat. Admodum positivus et perquam negativus aestimationes - nova series Netflix visores divisit.,https://antyweb.pl/niewiarygodna-burza-wokol-nowosci-netflixa-ten-serial-budzi-skrajne-emocje,"https://static.antyweb.pl/img/w_1250,h_550/wp-content/uploads/2026/05/nemesis-1.jpg",,"Nowy serial Netflixa pod tytuem ""Nemezis"" wywoa ogromne poruszenie, a wszystko przez skrajne opinie na jego temat. Produkcja zadebiutowaa kilka dni temu i natychmiast podzielia odbiorców. A 90% recen… [+1840 chars]",,2026-05-26 22:02:37+00:00,random,,,
7672b53f52accffddb222730152b788a,2026-05-20T14:55:16Z,Heat Wave,fala upałów,natemat.pl,pl,0.9,"Die Wettervorhersage sieht extrem aus. Erst die Stürme, dann die ersten Hitzewellen. In Polen kommt die erste Hitzewelle. Die IMWM-Wettervorhersage lässt keine Zweifel aufkommen: Am kommenden Wochenende werden es bis zu 30 Grad Celsius. Dies ist erst der Anfang dessen, was der Rekordsommer 2026 für uns bereithält. Überprüfen Sie, wo es heftige Stürme, Regenschauer usw. geben wird.","Prognoza pogody wygląda ekstremalnie. Najpierw burze, potem pierwsze upały","Nadciąga pierwsza fala upałów w Polsce. Prognoza pogody IMGW nie pozostawia złudzeń – najbliższy weekend przyniesie nawet 30 stopni Celsjusza. To zaledwie początek tego, co szykuje dla nas rekordowe lato 2026. Sprawdź, gdzie wystąpią gwałtowne burze, przelotn…","The weather forecast looks extreme. First the storms, then the first heatwaves. The first heat wave is coming in Poland. The IMWM weather forecast leaves no doubts - next weekend will bring up to 30 degrees Celsius. This is just the beginning of what the record-breaking summer of 2026 has in store for us. Check where there will be violent storms, showers…","Tempestas praenuntientur spectat extremam. Primae tempestates, deinde primi aestus. Primus calor fluctus Poloniam venit. ImWM tempestas praenuntiativum non dubitat - proxima volutpat ad XXX gradus Celsius adducet. Hoc solum initium est quod aestas record-fractionis 2026 nobis volvit. Reprehendo ubi procellae vehemens erunt, imbres…","https://natemat.pl/654124,prognoza-pogody-wyglada-ekstremalnie-najpierw-burze-potem-pierwsze-upaly","https://m.natemat.pl/d7334f593422bebdfc71108cb9fbf67c,1920,1080,0,0.webp",,"Przed nami pierwsze w tym roku upay, które odczujemy w caej Polsce. W nadchodzcy weekend termometry wska nawet 30 stopni Celsjusza. To jednak tylko przedsmak tego, co nas czeka latem.
Daj napiwek au… [+2786 chars]",,2026-05-27 13:57:58+00:00,random,,,
79155da7ca63c352147356f4c553d030,2026-05-02T06:28:00Z,Snow&Ice,mroźna Afryka Południowa,kobieta.gazeta.pl,pl,0.3,"Reserved verkauft Wildlederhandtaschen für ein paar Cent – ​​das sind Modelle, die jahrelang halten. Was ist in Sinsay los? Es sieht aus wie aus einer teuren Boutique und kostet wirklich wenig. Handtaschen aus Wildleder erfreuen sich wieder großer Beliebtheit und das ist kaum überraschend. Sie sind elegant, weich und passen zu fast allem. Gerade ist ein Modell in Reserved aufgetaucht, das möglicherweise schnell aus dem Lager verschwindet",Reserved wyprzedaje zamszowe torebki za grosze - to modele na lata. Co w Sinsay?,"Wygląda jak z drogiego butiku, a kosztuje naprawdę niewiele. Zamszowe torebki wracają do łask i trudno się temu dziwić. Są eleganckie, miękkie i pasują niemal do wszystkiego. W Reserved właśnie pojawił się model, który może szybko zniknąć z pół","Reserved sells suede handbags for pennies - these are models that will last for years. What's going on in Sinsay? It looks like from an expensive boutique, and it costs really little. Suede handbags are coming back into favor and it's hardly surprising. They are elegant, soft and match almost everything. A model has just appeared in Reserved that may quickly disappear from stock","Reservatis vendit sequebatur acus pro denariis - Haec exempla sunt quae duratura sunt annis. Quid agitur in Sinsay? Similis est e pretioso boutique, et vere parum constat. Suedae manus in gratiam redeunt et vix mirum est. Eleganter, mollia, omnia fere par. Exemplar modo apparuit in ligula quae celeriter ab stirpe evanescet","https://kobieta.gazeta.pl/zycie-i-styl/7,197850,32758679,reserved-wyprzedaje-zamszowe-torebki-za-grosze-to-modele-na.html","https://bi.im-g.pl/im/12/3e/1f/z32760082IER,Torebka-zamszowa.jpg",,Czasem jedna dobrze dobrana torebka potrafi zmienić całą stylizację. Zwłaszcza jeśli jest utrzymana w ponadczasowym stylu i spokojnej kolorystyce. Właśnie takie modele najczęściej nosimy przez kilka … [+1556 chars],,2026-05-27 18:10:20+00:00,wmo,South Africa,WSAF,Africa
1db532eeae35ee098ebae03d1fa9b078,2026-05-02T19:54:00Z,Drought,susza na Łotwie,kobieta.gazeta.pl,pl,0.3,"Diese Lederschuhe sind perfekt für schmale Füße – jetzt gibt es sie auch um 20 % reduziert. Nicht jeder Schuh passt gut zu einem schmalen Fuß, das wissen viele Frauen. Wenn Sie also ein Modell gefunden haben, das wirklich passt, lohnt sich ein Blick darauf. Diese Lederschuhe fallen nicht nur durch ihren Komfort, sondern auch durch ihren klassischen Look auf.",Te skórzane półbuty to ideał dla wąskiej stopy - teraz są dodatkowo przecenione o 20%,"Nie każde buty dobrze leżą na wąskiej stopie, to fakt, który zna wiele kobiet. Dlatego gdy trafia się model, który naprawdę pasuje, warto się nim zainteresować. Te skórzane półbuty przyciągają uwagę nie tylko wygodą, ale też klasycznym wyglądem.","These leather shoes are perfect for narrow feet - now they are also discounted by 20%. Not every shoe fits a narrow foot well, this is a fact that many women know. Therefore, when you find a model that really fits, it is worth taking a look at it. These leather shoes attract attention not only with their comfort, but also with their classic look.","Hi calcei coriarii perfecti sunt ad pedes angustos - nunc quoque a 20% discounted. Non omnis calceus bene convenit angusto pede, hoc est quod multae feminae sciunt. Ergo cum exemplar reperias quod vere congruit, valet inspicere. Hi aluta calcei non solum in consolatione notabilia sunt, sed etiam aspectus classicos.","https://kobieta.gazeta.pl/zycie-i-styl/7,197850,32758678,te-skorzane-polbuty-to-ideal-dla-waskiej-stopy-teraz-sa-dodatkowo.html","https://bi.im-g.pl/im/65/3a/1f/z32746341IER,Buty-Rieker.jpg",,Wygodne półbuty to podstawa wiosennej i letniej garderoby. Szczególnie jeśli spędzasz dużo czasu w ruchu i nie chcesz rezygnować ze stylu. Dobrze dobrany model potrafi sprawdzić się zarówno na co dzi… [+1584 chars],,2026-05-27 18:10:20+00:00,edo,Latvia,WCE,Europe
