index,module,topic,color,feed,term,created,country,ratio,counter,pages,language,ipcc,continent
'5f736e124a',extremes,Thunderstorm,#53785a,wmo,burza z piorunami w polsce,2026-05-27T06:46:00+00:00,Poland,0.5146375766703276,3,1,pl,WCE,Europe
'a37d0edcbf',extremes,Thunderstorm,#53785a,wmo,zła pogoda województwo łódzkie powiat łaski,2026-06-14T07:07:00+00:00,Poland,0.5054198750271652,1,1,pl,WCE,Europe
'6e288119bc',extremes,Precipitation,#d60d2b,wmo,opady w polsce,2026-06-10T06:49:00+00:00,Poland,0.5040156798171578,2,3,pl,WCE,Europe
'3d4bd352ac',extremes,Thunderstorm,#53785a,wmo,zła pogoda województwo pomorskie powiat chojnicki,2026-06-14T07:07:00+00:00,Poland,0.5038151316773346,1,1,pl,WCE,Europe
'c046f43a8d',extremes,Thunderstorm,#53785a,wmo,grad województwo śląskie powiat jaworzno,2026-06-01T07:30:00+00:00,Poland,0.5001765151933345,0,1,pl,WCE,Europe
'a22387ad2e',extremes,Precipitation,#d60d2b,wmo,deszczowa polska,2026-06-10T06:49:00+00:00,Poland,0.4999937094930124,1,1,pl,WCE,Europe
'cef815b506',extremes,Storm,#b3b2b1,wmo,fala sztormowa województwo lubelskie powiat zamojski,2026-06-02T07:08:00+00:00,Poland,0.4997746204964473,1,1,pl,WCE,Europe
'a4d94b3623',extremes,Thunderstorm,#53785a,wmo,burza województwo mazowieckie powiat płocki,2026-06-13T06:38:00+00:00,Poland,0.4977918464212609,1,1,pl,WCE,Europe
'0d83c6bdfb',extremes,Thunderstorm,#53785a,wmo,zła pogoda województwo podlaskie powiat bielski,2026-06-15T08:36:00+00:00,Poland,0.4920369824925882,1,1,pl,WCE,Europe
'1af313a328',extremes,Thunderstorm,#53785a,wmo,witaj polsko,2026-05-27T06:46:00+00:00,Poland,0.4863333467294348,2,1,pl,WCE,Europe
'671166b8ea',extremes,Storm,#b3b2b1,wmo,fala sztormowa rejon kłajpedzki,2026-06-15T08:36:00+00:00,Lithuania,0.4830461317464505,1,1,pl,WCE,Europe
'fce044716f',extremes,Thunderstorm,#53785a,wmo,zła pogoda województwo śląskie powiat tarnogórski,2026-06-01T07:30:00+00:00,Poland,0.4823490148172514,0,1,pl,WCE,Europe
'4354f5c317',extremes,Thunderstorm,#53785a,wmo,grad województwo śląskie powiat lubliniecki,2026-06-03T07:23:00+00:00,Poland,0.4790631102556767,0,1,pl,WCE,Europe
'c2a1de8dc8',extremes,Storm,#b3b2b1,wmo,burza Polska,2026-06-04T07:06:00+00:00,Poland,0.4782237144812793,3,3,pl,WCE,Europe
'57bf8d6b7b',extremes,Thunderstorm,#53785a,wmo,grad województwo lubelskie powiat radzyński,2026-06-12T07:05:00+00:00,Poland,0.478214820725341,0,1,pl,WCE,Europe
'2404faf9be',extremes,Thunderstorm,#53785a,wmo,burza województwo łódzkie powiat piotrkowski,2026-06-13T06:38:00+00:00,Poland,0.4776503829141411,0,1,pl,WCE,Europe
'7ee9329acc',extremes,Thunderstorm,#53785a,wmo,grad województwo lubelskie powiat zamojski,2026-06-12T07:05:00+00:00,Poland,0.4762977159645729,0,1,pl,WCE,Europe
'1a7757bde4',extremes,Thunderstorm,#53785a,wmo,zła pogoda województwo pomorskie powiat słupski,2026-06-14T07:07:00+00:00,Poland,0.4757282205015334,0,1,pl,WCE,Europe
'5ac6b59d5a',extremes,Thunderstorm,#53785a,wmo,grad województwo łódzkie powiat łódzki,2026-06-11T07:14:00+00:00,Poland,0.4745598245919346,0,1,pl,WCE,Europe
'776fe47817',extremes,Wildfire,#d60d2b,random,pożar,2026-05-18T06:38:00+00:00,,0.472371786383105,2,3,pl,,
'4f08f91021',extremes,Thunderstorm,#53785a,wmo,grad województwo lubuskie powiat słubicki,2026-06-14T07:07:00+00:00,Poland,0.4720515740052438,0,1,pl,WCE,Europe
'c4a0518d9e',extremes,Storm,#b3b2b1,wmo,burza województwo pomorskie powiat chojnicki,2026-06-15T08:36:00+00:00,Poland,0.47161227652458726,1,1,pl,WCE,Europe
'cba9cbfddd',extremes,Thunderstorm,#53785a,wmo,grad województwo lubelskie powiat puławski,2026-06-09T06:32:00+00:00,Poland,0.4586086367226264,2,1,pl,WCE,Europe
'2b6db9564c',extremes,Thunderstorm,#53785a,wmo,burza województwo lubelskie powiat bialski,2026-06-04T07:06:00+00:00,Poland,0.4538635892200673,2,1,pl,WCE,Europe
'f54eadc6be',extremes,Storm,#b3b2b1,wmo,wezbranie sztormowe województwo opolskie powiat nyski,2026-06-13T06:38:00+00:00,Poland,0.4525305467909763,2,1,pl,WCE,Europe
'91a5e43886',extremes,Thunderstorm,#53785a,wmo,burza województwo małopolskie powiat olkuski,2026-06-01T07:30:00+00:00,Poland,0.452369184714119,2,1,pl,WCE,Europe
'2180c0c4a1',extremes,Drought,#edc291,edo,brak opadów w polsce,2026-06-02T07:08:00+00:00,Poland,0.451991657383396,4,1,pl,WCE,Europe
'ce82cacf3c',extremes,Storm,#b3b2b1,wmo,wezbranie sztormowe województwo mazowieckie powiat płoński,2026-06-09T06:32:00+00:00,Poland,0.4515013006672077,2,1,pl,WCE,Europe
'4d9577e33d',extremes,Volcano,#b83202,random,wulkan,2026-05-21T06:34:00+00:00,,0.4510867326210181,4,2,pl,,
'826536d968',extremes,Storm,#b3b2b1,wmo,wezbranie sztormowe województwo łódzkie powiat łęczycki,2026-06-11T07:14:00+00:00,Poland,0.4509175334517605,2,1,pl,WCE,Europe
'736e25dde1',extremes,Precipitation,#d60d2b,wmo,ulewa litwa,2026-06-11T07:14:00+00:00,Lithuania,0.4495552470553962,1,1,pl,WCE,Europe
'26ada99d75',extremes,Storm,#b3b2b1,wmo,burza województwo mazowieckie powiat radomski,2026-06-09T06:32:00+00:00,Poland,0.4491678116416955,2,1,pl,WCE,Europe
'c89afb1d79',extremes,Precipitation,#d60d2b,wmo,ulewne deszcze województwo mazowieckie powiat siedlecki,2026-06-11T07:14:00+00:00,Poland,0.4488561845266716,1,1,pl,WCE,Europe
'dc3a8239f4',extremes,Storm,#b3b2b1,wmo,wezbranie sztormowe województwo łódzkie powiat łowicki,2026-06-09T06:32:00+00:00,Poland,0.4485908372428155,2,1,pl,WCE,Europe
'004d2c2888',extremes,Storm,#b3b2b1,wmo,wezbranie sztormowe woj. lubelskie powiat janowski,2026-06-11T07:14:00+00:00,Poland,0.4479172150123744,2,1,pl,WCE,Europe
'bc14e7b3e5',extremes,Storm,#b3b2b1,wmo,burza województwo śląskie powiat lubliniecki,2026-06-09T06:32:00+00:00,Poland,0.4478672390038526,2,1,pl,WCE,Europe
'2d4cf5b870',extremes,Storm,#b3b2b1,wmo,burza województwo łódzkie powiat brzeziński,2026-06-11T07:14:00+00:00,Poland,0.4470234324041531,2,1,pl,WCE,Europe
'd731643c9a',extremes,Storm,#b3b2b1,wmo,fala sztormowa województwo lubelskie powiat rycki,2026-06-09T06:32:00+00:00,Poland,0.44684437939239036,2,1,pl,WCE,Europe
'e5ff5d34c8',extremes,Storm,#b3b2b1,wmo,burza województwo łódzkie powiat łęczycki,2026-06-14T07:07:00+00:00,Poland,0.4467795427801881,2,1,pl,WCE,Europe
'34fb1626ae',extremes,Precipitation,#d60d2b,wmo,opady województwo pomorskie powiat słupski,2026-06-14T07:07:00+00:00,Poland,0.4459612049735562,1,1,pl,WCE,Europe
'5980ae6b3d',extremes,Thunderstorm,#53785a,wmo,zła pogoda województwo podkarpackie powiat krośnieński,2026-06-02T07:08:00+00:00,Poland,0.4454944015297542,2,1,pl,WCE,Europe
'933fd51796',extremes,Thunderstorm,#53785a,wmo,grad województwo podkarpackie powiat leski,2026-06-04T07:06:00+00:00,Poland,0.4454001420235284,2,1,pl,WCE,Europe
'e7a3b81c97',extremes,Storm,#b3b2b1,wmo,burza województwo lubuskie powiat gorzowski,2026-06-13T06:38:00+00:00,Poland,0.4450717450169813,2,1,pl,WCE,Europe
'32cd08972d',extremes,Storm,#b3b2b1,wmo,fala sztormowa województwo podlaskie powiat moniecki,2026-06-12T07:05:00+00:00,Poland,0.4446279665117261,2,1,pl,WCE,Europe
'fffa920622',extremes,Storm,#b3b2b1,wmo,fala sztormowa województwo mazowieckie powiat miński,2026-06-13T06:38:00+00:00,Poland,0.4445817263901145,2,1,pl,WCE,Europe
'014940efa6',extremes,Storm,#b3b2b1,wmo,fala sztormowa województwo mazowieckie powiat otwocki,2026-06-11T07:14:00+00:00,Poland,0.4445221415647519,2,1,pl,WCE,Europe
'fd984dab7a',extremes,Storm,#b3b2b1,wmo,fala sztormowa województwo pomorskie powiat gdański,2026-06-13T06:38:00+00:00,Poland,0.4444861183649254,2,1,pl,WCE,Europe
'2206074bfa',extremes,Precipitation,#d60d2b,wmo,ulewa polska,2026-06-10T06:49:00+00:00,Poland,0.4444178950683398,2,1,pl,WCE,Europe
'0aba7984ac',extremes,Thunderstorm,#53785a,wmo,zła pogoda województwo małopolskie powiat olkuski,2026-06-09T06:32:00+00:00,Poland,0.4444024237661182,1,1,pl,WCE,Europe
'510ed94b67',extremes,Storm,#b3b2b1,wmo,burza województwo podkarpackie powiat leski,2026-06-12T07:05:00+00:00,Poland,0.4443391583961369,2,1,pl,WCE,Europe
'7392131591',extremes,Storm,#b3b2b1,wmo,burza województwo opolskie powiat brzeski,2026-06-03T07:23:00+00:00,Poland,0.4443326740613622,2,1,pl,WCE,Europe
'4d52ffc699',extremes,Thunderstorm,#53785a,wmo,grad województwo pomorskie powiat sopot,2026-06-09T06:32:00+00:00,Poland,0.4443103291942968,2,1,pl,WCE,Europe
'258c60ed39',extremes,Storm,#b3b2b1,wmo,burza województwo śląskie powiat bielski,2026-06-09T06:32:00+00:00,Poland,0.4442675441272915,2,1,pl,WCE,Europe
'6a4f90098e',extremes,Storm,#b3b2b1,wmo,fala sztormowa województwo lubelskie powiat opolski,2026-06-09T06:32:00+00:00,Poland,0.4441411610009264,2,1,pl,WCE,Europe
'e3847def13',extremes,Storm,#b3b2b1,wmo,burza województwo podlaskie powiat białostocki,2026-06-14T07:07:00+00:00,Poland,0.44405658028281936,2,1,pl,WCE,Europe
'72699e8b6a',extremes,Storm,#b3b2b1,wmo,fala sztormowa województwo podlaskie powiat suwałki,2026-06-15T08:36:00+00:00,Poland,0.4439216941866862,2,1,pl,WCE,Europe
'c696ff6f0d',extremes,Storm,#b3b2b1,wmo,burza województwo łódzkie powiat rawski,2026-06-11T07:14:00+00:00,Poland,0.4427217271194651,2,1,pl,WCE,Europe
'a41eb25d17',extremes,Storm,#b3b2b1,wmo,burza województwo lubelskie powiat łęczyński,2026-06-12T07:05:00+00:00,Poland,0.4424714222738947,2,1,pl,WCE,Europe
'2645b53cb0',extremes,Storm,#b3b2b1,wmo,burza województwo pomorskie powiat słupski,2026-06-15T08:36:00+00:00,Poland,0.44200669138445997,2,1,pl,WCE,Europe
'4a6cf4dac6',extremes,Storm,#b3b2b1,wmo,wezbranie sztormowe województwo śląskie powiat rybnicki,2026-06-09T06:32:00+00:00,Poland,0.4418502796542538,2,1,pl,WCE,Europe
'428c9fc794',extremes,Storm,#b3b2b1,wmo,fala sztormowa województwo podlaskie powiat suwalski,2026-06-14T07:07:00+00:00,Poland,0.44122100956967963,2,1,pl,WCE,Europe
'3d72076751',extremes,Thunderstorm,#53785a,wmo,grad województwo śląskie powiat kłobucki,2026-06-01T07:30:00+00:00,Poland,0.4411700843841445,2,1,pl,WCE,Europe
'74ef4f56f0',extremes,Heat Wave,#c40202,wmo,fala upałów województwo lubelskie powiat kraśnicki,2026-06-09T06:32:00+00:00,Poland,0.440009097363964,2,1,pl,WCE,Europe
'ac301c19f4',extremes,Storm,#b3b2b1,wmo,wezbranie sztormowe województwo łódzkie powiat łódzki,2026-06-13T06:38:00+00:00,Poland,0.4398458800225169,2,1,pl,WCE,Europe
'30e7ccb91b',extremes,Thunderstorm,#53785a,wmo,burza województwo łódzkie powiat opoczyński,2026-06-09T06:32:00+00:00,Poland,0.4386486892287117,1,1,pl,WCE,Europe
'516da68350',extremes,Storm,#b3b2b1,wmo,burza województwo lubelskie powiat świdnicki,2026-06-14T07:07:00+00:00,Poland,0.4386382160236995,2,1,pl,WCE,Europe
'7fb4ddf871',extremes,Thunderstorm,#53785a,wmo,zła pogoda województwo małopolskie powiat brzeski,2026-06-09T06:32:00+00:00,Poland,0.4385688029249552,1,1,pl,WCE,Europe
'8de0fa42fc',extremes,Thunderstorm,#53785a,wmo,zła pogoda województwo pomorskie powiat pucki,2026-06-15T08:36:00+00:00,Poland,0.4377241747616346,2,1,pl,WCE,Europe
'566a740705',extremes,Thunderstorm,#53785a,wmo,zła pogoda województwo mazowieckie powiat siedlecki,2026-06-12T07:05:00+00:00,Poland,0.4375757775326087,2,1,pl,WCE,Europe
'1ab85de561',extremes,Storm,#b3b2b1,wmo,burza województwo podlaskie powiat bielski,2026-06-14T07:07:00+00:00,Poland,0.4371928669615692,2,1,pl,WCE,Europe
'd8fa8cb47d',extremes,Storm,#b3b2b1,wmo,fala sztormowa województwo lubelskie powiat lubelski,2026-06-14T07:07:00+00:00,Poland,0.43696263603158536,2,1,pl,WCE,Europe
'740e929bb6',extremes,Storm,#b3b2b1,wmo,burza województwo mazowieckie powiat płocki,2026-06-09T06:32:00+00:00,Poland,0.4361201159998069,2,1,pl,WCE,Europe
'589bf12fbd',extremes,Storm,#b3b2b1,wmo,fala sztormowa województwo pomorskie powiat słupski,2026-06-15T08:36:00+00:00,Poland,0.43609651650273856,2,1,pl,WCE,Europe
'4c8bd3e4d4',extremes,Insect Infestation,#d60d2b,random,szarańcza,2026-05-17T06:01:00+00:00,,0.4350780630979094,3,1,pl,,
'8a079fcf72',extremes,Thunderstorm,#53785a,wmo,burza województwo śląskie powiat myszkowski,2026-06-09T06:32:00+00:00,Poland,0.4349604340827272,1,1,pl,WCE,Europe
'2cb163b278',extremes,Thunderstorm,#53785a,wmo,zła pogoda województwo mazowieckie powiat otwocki,2026-06-09T06:32:00+00:00,Poland,0.4344259030072097,2,1,pl,WCE,Europe
'8612e7b92c',extremes,Thunderstorm,#53785a,wmo,grad województwo małopolskie powiat olkuski,2026-06-03T07:23:00+00:00,Poland,0.4343637490297769,2,1,pl,WCE,Europe
'b8d62762f6',extremes,Thunderstorm,#53785a,wmo,burza województwo łódzkie powiat łaski,2026-06-13T06:38:00+00:00,Poland,0.4337655721400263,2,1,pl,WCE,Europe
'd092f1c2a8',extremes,Storm,#b3b2b1,wmo,burza województwo pomorskie powiat malborski,2026-06-14T07:07:00+00:00,Poland,0.43354437154494085,2,1,pl,WCE,Europe
'69288ebd4f',extremes,Precipitation,#d60d2b,wmo,ulewne deszcze polska,2026-06-10T06:49:00+00:00,Poland,0.4331446698194096,2,1,pl,WCE,Europe
'baa7acceb1',extremes,Thunderstorm,#53785a,wmo,burza województwo śląskie powiat katowicki,2026-06-09T06:32:00+00:00,Poland,0.4330632788480374,1,1,pl,WCE,Europe
'45597d1cf8',extremes,Thunderstorm,#53785a,wmo,burza województwo podlaskie powiat łomżyński,2026-06-12T07:05:00+00:00,Poland,0.4330513095018538,2,1,pl,WCE,Europe
'46da916486',extremes,Storm,#b3b2b1,wmo,fala sztormowa województwo śląskie powiat mikołowski,2026-06-09T06:32:00+00:00,Poland,0.4322458334993468,2,1,pl,WCE,Europe
'97a72617a4',extremes,Thunderstorm,#53785a,wmo,burza województwo śląskie powiat będziński,2026-05-30T06:01:00+00:00,Poland,0.4320143223267416,2,1,pl,WCE,Europe
'68481abe73',extremes,Thunderstorm,#53785a,wmo,zła pogoda województwo pomorskie powiat gdyński,2026-06-13T06:38:00+00:00,Poland,0.4320125091137847,2,1,pl,WCE,Europe
'1757eb9923',extremes,Storm,#b3b2b1,wmo,burza województwo podlaskie powiat grajewski,2026-06-13T06:38:00+00:00,Poland,0.4318514845061879,2,1,pl,WCE,Europe
'6ba1924042',extremes,Thunderstorm,#53785a,wmo,grad województwo podlaskie powiat bielski,2026-06-13T06:38:00+00:00,Poland,0.4315842944371431,2,1,pl,WCE,Europe
'eb9729e54b',extremes,Storm,#b3b2b1,wmo,fala sztormowa województwo podlaskie powiat sokólski,2026-06-13T06:38:00+00:00,Poland,0.4311441736480568,2,1,pl,WCE,Europe
'1d4d4d08b8',extremes,Thunderstorm,#53785a,wmo,grad województwo lubuskie powiat sulęciński,2026-06-13T06:38:00+00:00,Poland,0.4310139350688193,2,1,pl,WCE,Europe
'5ad7703d50',extremes,Thunderstorm,#53785a,wmo,grad województwo pomorskie powiat lęborski,2026-06-15T08:36:00+00:00,Poland,0.4309938370320479,2,1,pl,WCE,Europe
'7b48d5ec75',extremes,Thunderstorm,#53785a,wmo,grad województwo małopolskie powiat suski,2026-06-09T06:32:00+00:00,Poland,0.4308719123361254,1,1,pl,WCE,Europe
'eed286d966',extremes,Heat Wave,#c40202,wmo,fala upałów województwo mazowieckie powiat miński,2026-06-09T06:32:00+00:00,Poland,0.4306340925721769,2,1,pl,WCE,Europe
'e41d0bfffe',extremes,Storm,#b3b2b1,wmo,fala sztormowa województwo podlaskie powiat hajnowski,2026-06-15T08:36:00+00:00,Poland,0.4304930487577408,2,1,pl,WCE,Europe
'6df032533f',extremes,Storm,#b3b2b1,wmo,burza województwo opolskie powiat opolski,2026-06-13T06:38:00+00:00,Poland,0.4300359437838378,2,1,pl,WCE,Europe
'2fc75780d0',extremes,Storm,#b3b2b1,wmo,burza województwo łódzkie powiat tomaszowski,2026-06-14T07:07:00+00:00,Poland,0.4299984565624297,2,1,pl,WCE,Europe
'ce4ebcf753',extremes,Storm,#b3b2b1,wmo,burza województwo podlaskie powiat suwałki,2026-06-14T07:07:00+00:00,Poland,0.4297579221318099,2,1,pl,WCE,Europe
'53116df675',extremes,Heat Wave,#c40202,wmo,fala upałów województwo mazowieckie powiat siedlecki,2026-06-09T06:32:00+00:00,Poland,0.4295842342425502,2,1,pl,WCE,Europe
'a924eee1bc',extremes,Thunderstorm,#53785a,wmo,grad województwo mazowieckie powiat miński,2026-06-11T07:14:00+00:00,Poland,0.429045250127727,2,1,pl,WCE,Europe
'5fafd9fbe6',extremes,Thunderstorm,#53785a,wmo,zła pogoda województwo opolskie powiat oleski,2026-06-09T06:32:00+00:00,Poland,0.4276022692212859,1,1,pl,WCE,Europe
'2b95b4181a',extremes,Storm,#b3b2b1,wmo,wezbranie sztormowe województwo łódzkie powiat sieradzki,2026-06-13T06:38:00+00:00,Poland,0.4275604882475469,2,1,pl,WCE,Europe
'0848b860f3',extremes,Storm,#b3b2b1,wmo,burza województwo lubelskie powiat janowski,2026-05-15T06:09:00+00:00,Poland,0.4260338046869419,3,1,pl,WCE,Europe
'fbfbc528cc',extremes,Storm,#b3b2b1,wmo,burza województwo mazowieckie powiat mławski,2026-06-09T06:32:00+00:00,Poland,0.4260058392570236,2,1,pl,WCE,Europe
'5f7b9ed1b0',extremes,Thunderstorm,#53785a,wmo,burza z piorunami województwo pomorskie powiat gdański,2026-06-09T06:32:00+00:00,Poland,0.4257189404427987,1,1,pl,WCE,Europe
'db201ef51e',extremes,Heat Wave,#c40202,wmo,fala upałów w polsce,2026-05-26T06:31:00+00:00,Poland,0.4248605179672562,5,1,pl,WCE,Europe
'102f0c17ef',extremes,Storm,#b3b2b1,wmo,burza województwo lubelskie powiat łukowski,2026-06-12T07:05:00+00:00,Poland,0.4244617743816741,2,1,pl,WCE,Europe
'b9a289b0b4',extremes,Thunderstorm,#53785a,wmo,zła pogoda województwo lubelskie powiat świdnicki,2026-06-12T07:05:00+00:00,Poland,0.4236625833631159,2,1,pl,WCE,Europe
'4a760e4ed4',extremes,Thunderstorm,#53785a,wmo,zła pogoda województwo lubelskie powiat rycki,2026-06-11T07:14:00+00:00,Poland,0.4236051912144057,2,1,pl,WCE,Europe
'7d96e1e0ea',extremes,Thunderstorm,#53785a,wmo,zła pogoda województwo mazowieckie powiat lipski,2026-06-13T06:38:00+00:00,Poland,0.42350376138577,2,1,pl,WCE,Europe
'07aad40156',extremes,Storm,#b3b2b1,wmo,burza województwo lubelskie powiat lubelski,2026-06-02T07:08:00+00:00,Poland,0.4233804222003736,2,1,pl,WCE,Europe
'2bad9fb951',extremes,Thunderstorm,#53785a,wmo,burza województwo śląskie powiat tarnogórski,2026-06-03T07:23:00+00:00,Poland,0.4213481264458966,2,1,pl,WCE,Europe
'aa2e706f42',extremes,Thunderstorm,#53785a,wmo,grad województwo lubelskie powiat lubelski,2026-06-02T07:08:00+00:00,Poland,0.4210396637680103,1,1,pl,WCE,Europe
'cc31ee194b',extremes,Thunderstorm,#53785a,wmo,burza województwo opolskie powiat brzeski,2026-06-09T06:32:00+00:00,Poland,0.4209947088349533,1,1,pl,WCE,Europe
'bb91f3a914',extremes,Storm,#b3b2b1,wmo,fala sztormowa województwo śląskie powiat katowicki,2026-05-15T06:09:00+00:00,Poland,0.4194842310198378,2,1,pl,WCE,Europe
'2df7f79f4e',extremes,Heat Wave,#c40202,cmeter,fala upałów w Paryżu,2026-05-29T06:39:00+00:00,France,0.4189645336963797,2,2,pl,,
'eaa0a40b2a',extremes,Heat Wave,#c40202,wmo,fala upałów województwo lubelskie powiat rycki,2026-06-09T06:32:00+00:00,Poland,0.4187356004068101,2,1,pl,WCE,Europe
'a4d587962e',extremes,Storm,#b3b2b1,wmo,burza województwo śląskie powiat kłobucki,2026-06-03T07:23:00+00:00,Poland,0.4186844411353889,2,1,pl,WCE,Europe
'ddb2e86fb0',extremes,Heat Wave,#c40202,wmo,fala upałów województwo mazowieckie powiat otwocki,2026-06-09T06:32:00+00:00,Poland,0.418437303196155,3,1,pl,WCE,Europe
'26037c6e0f',extremes,Thunderstorm,#53785a,wmo,"grad, Litwa",2026-06-10T06:49:00+00:00,Lithuania,0.417766283058661,1,1,pl,WCE,Europe
'76b962edf0',extremes,Thunderstorm,#53785a,wmo,burza województwo łódzkie powiat kutnowski,2026-05-15T06:09:00+00:00,Poland,0.417603695660718,2,1,pl,WCE,Europe
'7429ae7895',extremes,Storm,#b3b2b1,wmo,wezbranie sztormowe województwo łódzkie powiat brzeziński,2026-05-30T06:01:00+00:00,Poland,0.416872569760903,2,1,pl,WCE,Europe
'73cacc59a8',extremes,Thunderstorm,#53785a,wmo,zła pogoda województwo podlaskie powiat łomżyński,2026-06-13T06:38:00+00:00,Poland,0.4149169114692474,2,1,pl,WCE,Europe
'8757eb11cd',extremes,Thunderstorm,#53785a,wmo,burza województwo pomorskie powiat gdański,2026-06-07T06:48:00+00:00,Poland,0.4148089536800285,1,1,pl,WCE,Europe
'22c423bb3d',extremes,Precipitation,#d60d2b,wmo,ulewa województwo opolskie powiat nyski,2026-06-01T07:30:00+00:00,Poland,0.4147007150070879,2,1,pl,WCE,Europe
'147876226f',extremes,Thunderstorm,#53785a,wmo,ciężka pogoda w polsce,2026-05-27T06:46:00+00:00,Poland,0.4145714085933019,3,1,pl,WCE,Europe
'0819532a21',extremes,Snow&Ice,#d60d2b,wmo,śnieg województwo śląskie powiat sosnowiecki,2026-06-03T07:23:00+00:00,Poland,0.4144958654021867,2,1,pl,WCE,Europe
'3292e576a4',extremes,Storm,#b3b2b1,wmo,sztorm na wschodniej strefie przybrzeżnej,2026-05-20T06:33:00+00:00,Poland,0.4138428365092696,2,1,pl,WCE,Europe
'57f19e7909',extremes,Thunderstorm,#53785a,wmo,grad województwo opolskie powiat nyski,2026-06-09T06:32:00+00:00,Poland,0.4125055111903496,1,1,pl,WCE,Europe
'fa9e452d04',extremes,Precipitation,#d60d2b,random,burza,2026-05-25T06:52:00+00:00,,0.412043090302183,2,3,pl,,
'e225a247b0',extremes,Thunderstorm,#53785a,wmo,burza z piorunami na Litwie,2026-06-02T07:08:00+00:00,Lithuania,0.4117982115988174,2,1,pl,WCE,Europe
'3fe481b522',extremes,Storm,#b3b2b1,wmo,fala sztormowa w środkowej strefie przybrzeżnej,2026-05-26T06:31:00+00:00,Poland,0.4115444823219635,2,1,pl,WCE,Europe
'944abb8620',extremes,Thunderstorm,#53785a,wmo,zła pogoda województwo łódzkie powiat łęczycki,2026-06-09T06:32:00+00:00,Poland,0.4113264810730803,1,1,pl,WCE,Europe
'72907dc2b3',extremes,Precipitation,#d60d2b,wmo,opady województwo podlaskie powiat bielski,2026-06-11T07:14:00+00:00,Poland,0.4101258475492279,2,1,pl,WCE,Europe
'775290bf7a',extremes,Thunderstorm,#53785a,wmo,surowa pogoda województwo śląskie powiat rybnicki,2026-06-09T06:32:00+00:00,Poland,0.4093344022641668,1,1,pl,WCE,Europe
'3f6db550b4',extremes,Precipitation,#d60d2b,wmo,ulewa województwo podlaskie powiat sejneński,2026-06-11T07:14:00+00:00,Poland,0.4092107826860817,2,1,pl,WCE,Europe
'd180389ffa',extremes,Storm,#b3b2b1,wmo,burza województwo śląskie powiat sosnowiecki,2026-05-15T06:09:00+00:00,Poland,0.4091523773131708,2,1,pl,WCE,Europe
'bf4d550656',extremes,Precipitation,#d60d2b,wmo,opady województwo mazowieckie powiat mławski,2026-06-11T07:14:00+00:00,Poland,0.4091356039050953,2,1,pl,WCE,Europe
'9905185ab8',extremes,Thunderstorm,#53785a,wmo,grad województwo lubelskie powiat opolski,2026-06-12T07:05:00+00:00,Poland,0.4087781246407135,1,1,pl,WCE,Europe
'95f45e76fb',extremes,Thunderstorm,#53785a,wmo,grad w zachodniej strefie przybrzeżnej,2026-06-11T07:14:00+00:00,Poland,0.4085351461402981,1,1,pl,WCE,Europe
'2689ec9210',extremes,Storm,#b3b2b1,wmo,burza województwo podlaskie powiat moniecki,2026-05-19T06:33:00+00:00,Poland,0.4085063907965817,2,1,pl,WCE,Europe
'8622c18f5b',extremes,Thunderstorm,#53785a,wmo,grad województwo pomorskie powiat gdyński,2026-06-07T06:48:00+00:00,Poland,0.4075331598226874,1,1,pl,WCE,Europe
'1917c242d7',extremes,Thunderstorm,#53785a,wmo,grad województwo lubelskie powiat lubelski,2026-06-11T07:14:00+00:00,Poland,0.4073563142612187,1,1,pl,WCE,Europe
'2c3a801ff2',extremes,Thunderstorm,#53785a,wmo,grad województwo śląskie powiat ruda śląska,2026-06-09T06:32:00+00:00,Poland,0.4066299428612839,1,1,pl,WCE,Europe
'5575eab381',extremes,Heat Wave,#c40202,wmo,fala upałów województwo lubelskie powiat janowski,2026-06-09T06:32:00+00:00,Poland,0.4059275855232763,3,1,pl,WCE,Europe
'59b5340b69',extremes,Precipitation,#d60d2b,random,front atmosferyczny,2026-05-13T06:02:00+00:00,,0.4044842797069611,2,2,pl,,
'd43df3a489',extremes,Precipitation,#d60d2b,wmo,deszcz województwo lubelskie powiat włodawski,2026-06-11T07:14:00+00:00,Poland,0.4032267580228475,2,1,pl,WCE,Europe
'fe93d58d94',extremes,Storm,#b3b2b1,wmo,fala sztormowa województwo podkarpackie powiat krośnieński,2026-05-16T05:40:00+00:00,Poland,0.402497388249506,2,1,pl,WCE,Europe
'ebb4773137',extremes,Precipitation,#d60d2b,wmo,ulewa województwo pomorskie powiat sztumski,2026-06-11T07:14:00+00:00,Poland,0.4024440141203225,2,1,pl,WCE,Europe
'133c50a744',extremes,Storm,#b3b2b1,wmo,burza województwo łódzkie powiat łaski,2026-05-14T06:02:00+00:00,Poland,0.4024166118073132,2,1,pl,WCE,Europe
'574bf16088',extremes,Precipitation,#d60d2b,wmo,opady województwo śląskie powiat cieszyński,2026-06-10T06:49:00+00:00,Poland,0.4012246818378812,2,1,pl,WCE,Europe
'9e020e244e',extremes,Drought,#edc291,edo,susza w polsce,2026-05-23T05:53:00+00:00,Poland,0.4003383264363345,4,1,pl,WCE,Europe
'978977a576',extremes,Precipitation,#d60d2b,wmo,deszczowe województwo mazowieckie powiat radomski,2026-06-11T07:14:00+00:00,Poland,0.3994215700461179,2,1,pl,WCE,Europe
'25f080edf3',extremes,Storm,#b3b2b1,wmo,burza rejon kłajpedzki,2026-06-11T07:14:00+00:00,Lithuania,0.3979940209690564,2,1,pl,WCE,Europe
'feffdb8947',extremes,Storm,#b3b2b1,wmo,burza województwo pomorskie powiat kartuski,2026-05-14T06:02:00+00:00,Poland,0.3969031848040712,2,1,pl,WCE,Europe
'6668ff8b65',extremes,Storm,#b3b2b1,wmo,burza województwo podlaskie powiat łomżyński,2026-05-18T06:38:00+00:00,Poland,0.3965348214790876,2,1,pl,WCE,Europe
'68646514d9',extremes,Thunderstorm,#53785a,wmo,burza województwo łódzkie powiat zgierski,2026-06-01T07:30:00+00:00,Poland,0.3932728639757925,1,1,pl,WCE,Europe
'ecb62494d5',extremes,Thunderstorm,#53785a,wmo,zła pogoda województwo mazowieckie powiat płoński,2026-06-07T06:48:00+00:00,Poland,0.3931900888422753,3,1,pl,WCE,Europe
'828294ce85',extremes,Storm,#b3b2b1,wmo,fala sztormowa województwo mazowieckie powiat płocki,2026-05-14T06:02:00+00:00,Poland,0.392735751339212,2,1,pl,WCE,Europe
'432aba575c',extremes,Precipitation,#d60d2b,wmo,ulewa województwo mazowieckie powiat lipski,2026-06-11T07:14:00+00:00,Poland,0.3920931001298972,2,1,pl,WCE,Europe
'cd7b613ff1',extremes,Thunderstorm,#53785a,wmo,burza z piorunami województwo małopolskie powiat krakowski,2026-06-09T06:32:00+00:00,Poland,0.3920057514016964,3,1,pl,WCE,Europe
'937ff06462',extremes,Thunderstorm,#53785a,wmo,"burza województwo lubuskie, powiat żarski",2026-05-19T06:33:00+00:00,Poland,0.3909603797253516,2,1,pl,WCE,Europe
'74cf9bacf4',extremes,Storm,#b3b2b1,wmo,burza województwo mazowieckie powiat miński,2026-06-12T07:05:00+00:00,Poland,0.3908927222454688,3,1,pl,WCE,Europe
'eb63bf1b06',extremes,Precipitation,#d60d2b,wmo,ulewa województwo podlaskie powiat łomżyński,2026-06-11T07:14:00+00:00,Poland,0.3882004804123854,2,1,pl,WCE,Europe
'741d1245a0',extremes,Thunderstorm,#53785a,wmo,ciężka pogoda na Litwie,2026-05-14T06:02:00+00:00,Lithuania,0.3875854094539337,2,1,pl,WCE,Europe
