index,module,topic,color,feed,term,created,country,ratio,counter,pages,language,ipcc,continent
'a2f9e0dc38',extremes,Thunderstorm,#53785a,wmo,zła pogoda województwo łódzkie powiat brzeziński,2026-06-01T07:30:00+00:00,Poland,0.3861055521026401,3,1,pl,WCE,Europe
'a64d8f852c',extremes,Precipitation,#d60d2b,wmo,ulewa województwo mazowieckie powiat płocki,2026-06-11T07:14:00+00:00,Poland,0.3857657706174262,2,1,pl,WCE,Europe
'c2e46ad627',extremes,Thunderstorm,#53785a,wmo,surowa pogoda województwo lubuskie powiat żarski,2026-05-30T06:01:00+00:00,Poland,0.3853638732996661,3,1,pl,WCE,Europe
'a9f2e553dc',extremes,Thunderstorm,#53785a,wmo,grad województwo łódzkie powiat pajęczański,2026-06-09T06:32:00+00:00,Poland,0.3852975670766237,3,1,pl,WCE,Europe
'fe732a9082',extremes,Storm,#b3b2b1,wmo,burza województwo śląskie powiat chorzowski,2026-06-09T06:32:00+00:00,Poland,0.3849755867535231,3,1,pl,WCE,Europe
'1140dcbf1c',extremes,Storm,#b3b2b1,wmo,burza województwo śląskie powiat żywiecki,2026-06-09T06:32:00+00:00,Poland,0.3846793383061497,3,1,pl,WCE,Europe
'55917e5827',extremes,Precipitation,#d60d2b,wmo,ulewa województwo mazowieckie powiat płoński,2026-06-11T07:14:00+00:00,Poland,0.3846431399179726,2,1,pl,WCE,Europe
'78312bc95a',extremes,Thunderstorm,#53785a,wmo,grad województwo mazowieckie powiat mławski,2026-05-19T06:33:00+00:00,Poland,0.3833846261440002,2,1,pl,WCE,Europe
'e49bb13411',extremes,Thunderstorm,#53785a,wmo,grad województwo mazowieckie powiat otwocki,2026-06-01T07:30:00+00:00,Poland,0.3832320073798774,3,1,pl,WCE,Europe
'1cdf517dbd',extremes,Thunderstorm,#53785a,wmo,burza województwo mazowieckie powiat siedlecki,2026-06-09T06:32:00+00:00,Poland,0.3829485642997406,3,1,pl,WCE,Europe
'22c1ff1179',extremes,Thunderstorm,#53785a,wmo,grad województwo łódzkie powiat wieluński,2026-06-09T06:32:00+00:00,Poland,0.3829018741468081,3,1,pl,WCE,Europe
'255375d949',extremes,Thunderstorm,#53785a,wmo,burza województwo śląskie powiat rybnicki,2026-06-01T07:30:00+00:00,Poland,0.3827188347333792,3,1,pl,WCE,Europe
'53fda39314',extremes,Drought,#edc291,edo,brak opadów na Litwie,2026-05-30T06:01:00+00:00,Lithuania,0.3823162822678096,3,1,pl,WCE,Europe
'dce756fefb',extremes,Thunderstorm,#53785a,wmo,grad województwo śląskie powiat bytomski,2026-06-01T07:30:00+00:00,Poland,0.3816813584020168,3,1,pl,WCE,Europe
'439cdbcee9',extremes,Storm,#b3b2b1,wmo,fala sztormowa województwo pomorskie powiat lęborski,2026-06-07T06:48:00+00:00,Poland,0.3813813814890475,3,1,pl,WCE,Europe
'773881b8d5',extremes,Thunderstorm,#53785a,wmo,burza województwo pomorskie powiat lęborski,2026-05-14T06:02:00+00:00,Poland,0.3807037993622634,2,1,pl,WCE,Europe
'a10fae0f4e',extremes,Storm,#b3b2b1,wmo,burza województwo pomorskie powiat sztumski,2026-06-07T06:48:00+00:00,Poland,0.3803836297818472,3,1,pl,WCE,Europe
'0a067fb676',extremes,Storm,#b3b2b1,wmo,fala sztormowa województwo śląskie powiat mysłowicki,2026-06-03T07:23:00+00:00,Poland,0.3797569552119276,3,1,pl,WCE,Europe
'fe9f06f03f',extremes,Storm,#b3b2b1,wmo,burza województwo lubelskie powiat kraśnicki,2026-06-01T07:30:00+00:00,Poland,0.3791179822951489,3,1,pl,WCE,Europe
'a8e12856df',extremes,Thunderstorm,#53785a,wmo,burza województwo mazowieckie powiat mławski,2026-05-18T06:38:00+00:00,Poland,0.3783988292423473,2,1,pl,WCE,Europe
'94cb9eca4c',extremes,Storm,#b3b2b1,wmo,burza województwo łódzkie powiat pabianicki,2026-06-01T07:30:00+00:00,Poland,0.3782025564800469,3,1,pl,WCE,Europe
'3a9f7ed519',extremes,Storm,#b3b2b1,wmo,fala sztormowa województwo pomorskie powiat słupski,2026-06-07T06:48:00+00:00,Poland,0.3766957683627563,3,1,pl,WCE,Europe
'1d7f2a6b94',extremes,Precipitation,#d60d2b,wmo,opady województwo śląskie powiat żywiecki,2026-05-16T05:40:00+00:00,Poland,0.3762833946454215,2,1,pl,WCE,Europe
'935d2a49b9',extremes,Thunderstorm,#53785a,wmo,grad województwo lubelskie powiat chełmski,2026-05-18T06:38:00+00:00,Poland,0.3758823186074108,2,1,pl,WCE,Europe
'3e24259ce0',extremes,Thunderstorm,#53785a,wmo,burza województwo lubelskie powiat włodawski,2026-05-16T05:40:00+00:00,Poland,0.3755670118489593,1,1,pl,WCE,Europe
'4abecd55e4',extremes,Thunderstorm,#53785a,wmo,zła pogoda województwo wielkopolskie powiat koniński,2026-05-14T06:02:00+00:00,Poland,0.3753847714171462,2,1,pl,WCE,Europe
'6a8d6878c0',extremes,Storm,#b3b2b1,wmo,fala sztormowa województwo lubelskie powiat świdnicki,2026-06-02T07:08:00+00:00,Poland,0.3752122117114387,3,1,pl,WCE,Europe
'd389b29a32',extremes,Storm,#b3b2b1,wmo,fala sztormowa województwo pomorskie powiat kartuski,2026-06-07T06:48:00+00:00,Poland,0.3730873989207099,3,1,pl,WCE,Europe
'98db96b6de',extremes,Drought,#edc291,edo,susza na Litwie,2026-05-17T06:01:00+00:00,Lithuania,0.3727518269894169,2,1,pl,WCE,Europe
'806961614d',extremes,Storm,#b3b2b1,wmo,wezbranie sztormowe województwo opolskie powiat prudnicki,2026-05-30T06:01:00+00:00,Poland,0.3727182554888563,3,1,pl,WCE,Europe
'f428fa2fc6',extremes,Thunderstorm,#53785a,wmo,grad województwo śląskie powiat chorzowski,2026-05-15T06:09:00+00:00,Poland,0.3720974843117248,2,1,pl,WCE,Europe
'64f3ae65bf',extremes,Thunderstorm,#53785a,wmo,grad województwo lubelskie powiat łęczyński,2026-05-18T06:38:00+00:00,Poland,0.3720366815086265,2,1,pl,WCE,Europe
'895007d2de',extremes,Snow Avalanche,#deddd5,wmo,lawina w norwegii,2026-05-20T06:33:00+00:00,Norway,0.3717953328558957,2,2,pl,NEU,Europe
'71ea7059f5',extremes,Thunderstorm,#53785a,wmo,surowa pogoda województwo lubelskie powiat bialski,2026-05-20T06:33:00+00:00,Poland,0.3717610368776872,2,1,pl,WCE,Europe
'8697ab7a40',extremes,Thunderstorm,#53785a,wmo,burza województwo łódzkie powiat poddębicki,2026-05-15T06:09:00+00:00,Poland,0.3703343550997597,2,1,pl,WCE,Europe
'5d0e229cc3',extremes,Thunderstorm,#53785a,wmo,grad województwo podlaskie powiat suwalski,2026-06-08T07:13:00+00:00,Poland,0.3698979976518342,2,1,pl,WCE,Europe
'fdd06e2386',extremes,Thunderstorm,#53785a,wmo,burza województwo lubelskie powiat rycki,2026-06-02T07:08:00+00:00,Poland,0.3695114677931017,3,1,pl,WCE,Europe
'450c53b3e9',extremes,Thunderstorm,#53785a,wmo,grad województwo łódzkie powiat zgierski,2026-06-09T06:32:00+00:00,Poland,0.3692623628298453,2,1,pl,WCE,Europe
'3a9bfd80d9',extremes,Thunderstorm,#53785a,wmo,burza województwo lubelskie powiat świdnicki,2026-06-01T07:30:00+00:00,Poland,0.3688804600513117,3,1,pl,WCE,Europe
'1840bf5e77',extremes,Storm,#b3b2b1,wmo,burza województwo łódzkie powiat łódzki,2026-05-30T06:01:00+00:00,Poland,0.3687720781609794,3,1,pl,WCE,Europe
'5b33a8ba38',extremes,Storm,#b3b2b1,wmo,fala sztormowa województwo śląskie powiat bytomski,2026-05-30T06:01:00+00:00,Poland,0.368653945930685,3,1,pl,WCE,Europe
'20d3194153',extremes,Thunderstorm,#53785a,wmo,ciężka pogoda województwo śląskie powiat cieszyński,2026-05-30T06:01:00+00:00,Poland,0.368342386527495,3,1,pl,WCE,Europe
'2368b2d2d8',extremes,Storm,#b3b2b1,wmo,burza województwo lubuskie powiat żagański,2026-06-04T07:06:00+00:00,Poland,0.3680675233567129,3,1,pl,WCE,Europe
'595acbcf9f',extremes,Heat Wave,#c40202,random,najgorętszy dzień,2026-05-17T06:01:00+00:00,,0.3676081572834747,3,2,pl,,
'8dc0b2ba5e',extremes,Thunderstorm,#53785a,wmo,burza województwo podlaskie powiat sokólski,2026-06-08T07:13:00+00:00,Poland,0.3676060895115487,2,1,pl,WCE,Europe
'ec3c860785',extremes,Thunderstorm,#53785a,wmo,grad województwo łódzkie powiat sieradzki,2026-06-09T06:32:00+00:00,Poland,0.3674252798743617,2,1,pl,WCE,Europe
'1c4e7fb6c7',extremes,Fog,#d60d2b,wmo,mgła na Litwie,2026-06-06T06:08:00+00:00,Lithuania,0.3668182707610287,3,1,pl,WCE,Europe
'bb77bd741f',extremes,Storm,#b3b2b1,wmo,wezbranie sztormowe województwo mazowieckie powiat łosicki,2026-06-01T07:30:00+00:00,Poland,0.3665257005169025,3,1,pl,WCE,Europe
'879aed5b1e',extremes,Storm,#b3b2b1,wmo,fala sztormowa województwo lubelskie powiat włodawski,2026-06-02T07:08:00+00:00,Poland,0.3660603431807622,3,1,pl,WCE,Europe
'596eeee208',extremes,Precipitation,#d60d2b,wmo,opady województwo małopolskie powiat suski,2026-05-16T05:40:00+00:00,Poland,0.3658155413919065,2,1,pl,WCE,Europe
'f81d04c10d',extremes,Storm,#b3b2b1,wmo,burza województwo pomorskie powiat sopocki,2026-06-07T06:48:00+00:00,Poland,0.3657582155727584,3,1,pl,WCE,Europe
'080f75259e',extremes,Storm,#b3b2b1,wmo,fala sztormowa województwo pomorskie powiat sztumski,2026-05-21T06:35:00+00:00,Poland,0.3648183487794652,3,1,pl,WCE,Europe
'a83be30a23',extremes,Storm,#b3b2b1,wmo,fala sztormowa województwo śląskie powiat jaworzno,2026-06-03T07:23:00+00:00,Poland,0.3648113780846695,3,1,pl,WCE,Europe
'ae8498c661',extremes,Storm,#b3b2b1,wmo,burza województwo łódzkie powiat pajęczański,2026-06-03T07:23:00+00:00,Poland,0.3645416719979925,3,1,pl,WCE,Europe
'a62d851f87',extremes,Storm,#b3b2b1,wmo,burza województwo podlaskie powiat hajnowski,2026-05-19T06:33:00+00:00,Poland,0.3641735866535012,3,1,pl,WCE,Europe
'59d2d8c606',extremes,Storm,#b3b2b1,wmo,fala sztormowa województwo lubuskie powiat nowosolski,2026-06-04T07:06:00+00:00,Poland,0.3640804388549517,3,1,pl,WCE,Europe
'd6131987a7',extremes,Thunderstorm,#53785a,wmo,grad województwo podlaskie powiat sejneński,2026-06-08T07:13:00+00:00,Poland,0.3631723249638868,2,1,pl,WCE,Europe
'c80cb98276',extremes,Thunderstorm,#53785a,wmo,burza województwo łódzkie powiat łęczycki,2026-06-07T06:48:00+00:00,Poland,0.3631258534785564,3,1,pl,WCE,Europe
'0386e85f14',extremes,Thunderstorm,#53785a,wmo,burza województwo łódzkie powiat łowicki,2026-06-07T06:48:00+00:00,Poland,0.362643388033185,2,1,pl,WCE,Europe
'9eb5abf250',extremes,Storm,#b3b2b1,wmo,burza województwo mazowieckie powiat płoński,2026-06-01T07:30:00+00:00,Poland,0.3620377204325655,3,1,pl,WCE,Europe
'ba29589557',extremes,Storm,#b3b2b1,wmo,fala sztormowa województwo śląskie powiat myszkowski,2026-05-30T06:01:00+00:00,Poland,0.3618796424838124,3,1,pl,WCE,Europe
'5cd105af10',extremes,Thunderstorm,#53785a,wmo,zła pogoda województwo lubelskie powiat lubelski,2026-05-15T06:09:00+00:00,Poland,0.3616118080973192,2,1,pl,WCE,Europe
'87ff06c7ad',extremes,Storm,#b3b2b1,wmo,fala sztormowa województwo śląskie powiat gliwicki,2026-05-30T06:01:00+00:00,Poland,0.3613728364851125,3,1,pl,WCE,Europe
'52b2041752',extremes,Storm,#b3b2b1,wmo,wezbranie sztormowe województwo łódzkie powiat kutnowski,2026-06-01T07:30:00+00:00,Poland,0.3612605514791898,3,1,pl,WCE,Europe
'b74d80740a',extremes,Storm,#b3b2b1,wmo,wezbranie sztormowe województwo łódzkie powiat wieluński,2026-05-30T06:01:00+00:00,Poland,0.3612475846395974,3,1,pl,WCE,Europe
'36f3b7611f',extremes,Storm,#b3b2b1,wmo,burza województwo opolskie powiat głubczycki,2026-06-03T07:23:00+00:00,Poland,0.3609505962178727,3,1,pl,WCE,Europe
'6742edc857',extremes,Thunderstorm,#53785a,wmo,grad województwo śląskie powiat będziński,2026-06-03T07:23:00+00:00,Poland,0.3607905119836668,3,1,pl,WCE,Europe
'628bf5d4cb',extremes,Storm,#b3b2b1,wmo,sztorm w środkowej strefie przybrzeżnej,2026-05-27T06:46:00+00:00,Poland,0.3605776115985097,3,1,pl,WCE,Europe
'25f73708a2',extremes,Storm,#b3b2b1,wmo,burza województwo lubuskie powiat nowosolski,2026-05-30T06:01:00+00:00,Poland,0.3605718646282554,3,1,pl,WCE,Europe
'394ffc0042',extremes,Precipitation,#d60d2b,wmo,deszcz ulewny województwo śląskie powiat cieszyński,2026-05-16T05:40:00+00:00,Poland,0.3600307372220716,2,1,pl,WCE,Europe
'966a6e8bf2',extremes,Storm,#b3b2b1,wmo,fala sztormowa województwo małopolskie powiat brzeski,2026-06-03T07:23:00+00:00,Poland,0.359908031533143,3,1,pl,WCE,Europe
'695bc60a7c',extremes,Thunderstorm,#53785a,wmo,zła pogoda województwo śląskie powiat gliwicki,2026-06-01T07:30:00+00:00,Poland,0.3583643193369796,2,1,pl,WCE,Europe
'b4cd8bfe1e',extremes,ice jam,#d60d2b,random,powódź,2026-05-19T06:33:00+00:00,,0.3571819981225721,2,2,pl,,
'2c1beb5d89',extremes,Thunderstorm,#53785a,wmo,burza województwo śląskie powiat rybnicki,2026-06-03T07:23:00+00:00,Poland,0.357129747657361,2,1,pl,WCE,Europe
'8a2f2c0d0e',extremes,Drought,#edc291,edo,brak deszczu na Ukrainie,2026-05-19T06:33:00+00:00,Ukraine,0.3567178258599937,2,1,pl,WCE,Europe
'18fe399589',extremes,Storm,#b3b2b1,wmo,fala sztormowa na Litwie,2026-05-25T06:53:00+00:00,Lithuania,0.3563814529641305,3,1,pl,WCE,Europe
'16c04e291e',extremes,Thunderstorm,#53785a,wmo,grad województwo łódzkie powiat opoczyński,2026-05-30T06:01:00+00:00,Poland,0.3563562706667017,2,1,pl,WCE,Europe
'c7404ffe12',extremes,Thunderstorm,#53785a,wmo,zła pogoda województwo lubuskie powiat gorzowski,2026-05-30T06:01:00+00:00,Poland,0.3560905227660042,2,1,pl,WCE,Europe
'4568bfdae6',extremes,Thunderstorm,#53785a,wmo,grad województwo pomorskie powiat słupski,2026-05-14T06:02:00+00:00,Poland,0.3559647685564703,2,1,pl,WCE,Europe
'd5ca34d448',extremes,Thunderstorm,#53785a,wmo,burza województwo lubelskie powiat janowski,2026-06-02T07:08:00+00:00,Poland,0.3557080044571445,2,1,pl,WCE,Europe
'dd0f43c761',extremes,Precipitation,#d60d2b,wmo,deszcz Litwa,2026-05-18T06:38:00+00:00,Lithuania,0.3553897653112852,2,1,pl,WCE,Europe
'9e68c3ca02',extremes,Thunderstorm,#53785a,wmo,burza województwo śląskie powiat raciborski,2026-06-03T07:23:00+00:00,Poland,0.3548654408525934,2,1,pl,WCE,Europe
'9bbedf32bf',extremes,Thunderstorm,#53785a,wmo,zła pogoda województwo śląskie powiat myszkowski,2026-05-15T06:09:00+00:00,Poland,0.3546708724087303,2,1,pl,WCE,Europe
'1f5c6b6fb5',extremes,Thunderstorm,#53785a,wmo,burza województwo podlaskie powiat suwalski,2026-06-02T07:08:00+00:00,Poland,0.3537758671821179,2,1,pl,WCE,Europe
'ca7c25a10a',extremes,Storm,#b3b2b1,wmo,fala sztormowa w zachodniej strefie przybrzeżnej,2026-05-30T06:01:00+00:00,Poland,0.3534674498478908,3,1,pl,WCE,Europe
'93800bd4bf',extremes,Thunderstorm,#53785a,wmo,burza z piorunami województwo małopolskie powiat suski,2026-06-03T07:23:00+00:00,Poland,0.3532179622030906,2,1,pl,WCE,Europe
'f90601fa23',extremes,Volcano,#b83202,random,erupcja wulkanu,2026-05-17T06:01:00+00:00,,0.3531693862331246,2,1,pl,,
'e082513025',extremes,Thunderstorm,#53785a,wmo,zła pogoda województwo podkarpackie powiat leski,2026-06-11T07:14:00+00:00,Poland,0.3526002281705314,2,1,pl,WCE,Europe
'3e4b341619',extremes,Storm,#b3b2b1,random,burza,2026-05-20T06:32:00+00:00,,0.3521371688275543,1,3,pl,,
'ed4dbfb27b',extremes,Heat Wave,#c40202,wmo,fala upałów województwo lubuskie powiat żagański,2026-05-26T06:31:00+00:00,Poland,0.3509504827124058,4,1,pl,WCE,Europe
'15a9c61e3e',extremes,Landslide,#572c03,random,osuwisko,2026-05-11T06:14:00+00:00,,0.350608920733251,2,2,pl,,
'1d9c104bbb',extremes,Storm,#b3b2b1,wmo,burza na Litwie,2026-05-24T06:22:00+00:00,Lithuania,0.3501136017259825,3,1,pl,WCE,Europe
'314fbeccec',extremes,Thunderstorm,#53785a,wmo,grad województwo śląskie powiat myszkowski,2026-06-01T07:30:00+00:00,Poland,0.3499320181265463,2,1,pl,WCE,Europe
'3de033d52b',extremes,Thunderstorm,#53785a,wmo,burza województwo śląskie powiat żorski,2026-06-03T07:23:00+00:00,Poland,0.3494010299978106,2,1,pl,WCE,Europe
'a129125ca1',extremes,Thunderstorm,#53785a,wmo,burza województwo łódzkie powiat sieradzki,2026-05-30T06:01:00+00:00,Poland,0.3490486385272819,2,1,pl,WCE,Europe
'9977620679',extremes,Thunderstorm,#53785a,wmo,zła pogoda województwo opolskie powiat nyski,2026-06-03T07:23:00+00:00,Poland,0.3490080716960168,2,1,pl,WCE,Europe
'2745cf383e',extremes,Thunderstorm,#53785a,wmo,grad województwo śląskie powiat zabrzeski,2026-06-01T07:30:00+00:00,Poland,0.3488825446278752,2,1,pl,WCE,Europe
'87b5d3b5ef',extremes,Thunderstorm,#53785a,wmo,grad województwo lubuskie powiat wschowski,2026-05-30T06:01:00+00:00,Poland,0.3487558644458171,2,1,pl,WCE,Europe
'c7bdc6486d',extremes,Thunderstorm,#53785a,wmo,grad województwo śląskie powiat bielski,2026-06-01T07:30:00+00:00,Poland,0.3481562869225906,2,1,pl,WCE,Europe
'5399d10b82',extremes,Thunderstorm,#53785a,wmo,burza województwo śląskie powiat chorzowski,2026-05-30T06:01:00+00:00,Poland,0.3479821343593652,2,1,pl,WCE,Europe
'8053ccfab3',extremes,Thunderstorm,#53785a,wmo,grad województwo pomorskie powiat bytowski,2026-06-07T06:48:00+00:00,Poland,0.347784166349426,2,1,pl,WCE,Europe
'44bb194a41',extremes,Thunderstorm,#53785a,wmo,burza województwo śląskie powiat ruda śląska,2026-05-30T06:01:00+00:00,Poland,0.3470263328401973,2,1,pl,WCE,Europe
'6389edd212',extremes,Thunderstorm,#53785a,wmo,burza z piorunami województwo podkarpackie powiat leski,2026-06-03T07:23:00+00:00,Poland,0.3466737092842135,2,1,pl,WCE,Europe
'ee676ccabe',extremes,Thunderstorm,#53785a,wmo,burza województwo podkarpackie powiat krośnieński,2026-05-27T06:46:00+00:00,Poland,0.345244539098866,2,1,pl,WCE,Europe
'4642d4484d',extremes,Thunderstorm,#53785a,wmo,burza województwo lubelskie powiat zamojski,2026-06-01T07:30:00+00:00,Poland,0.3450024294264504,2,1,pl,WCE,Europe
'30166cec90',extremes,Thunderstorm,#53785a,wmo,zła pogoda województwo łódzkie powiat wieluński,2026-06-03T07:23:00+00:00,Poland,0.3449508727844214,2,1,pl,WCE,Europe
'7af964ef6f',extremes,Storm,#b3b2b1,wmo,wezbranie sztormowe województwo lubuskie powiat żagański,2026-05-19T06:33:00+00:00,Poland,0.3440568986717762,3,1,pl,WCE,Europe
'39d9d4bd73',extremes,Thunderstorm,#53785a,wmo,grad województwo podkarpackie powiat krośnieński,2026-06-04T07:06:00+00:00,Poland,0.3429281833742993,2,1,pl,WCE,Europe
'b1d56de062',extremes,Snow&Ice,#d60d2b,random,szron,2026-05-21T06:34:00+00:00,,0.3427505400455303,2,1,pl,,
'17392b9b0b',extremes,Thunderstorm,#53785a,wmo,"burza województwo lubuskie, powiat słubicki",2026-05-30T06:01:00+00:00,Poland,0.3423448965322657,2,1,pl,WCE,Europe
'191ee1d1e7',extremes,Thunderstorm,#53785a,wmo,grad województwo śląskie powiat teski,2026-05-30T06:01:00+00:00,Poland,0.341662136673184,2,1,pl,WCE,Europe
'59ee429157',extremes,Thunderstorm,#53785a,wmo,burza województwo mazowieckie powiat płoński,2026-05-21T06:35:00+00:00,Poland,0.3407216305737562,2,1,pl,WCE,Europe
'd987c4a64e',extremes,Thunderstorm,#53785a,wmo,burza województwo mazowieckie powiat lipski,2026-06-01T07:30:00+00:00,Poland,0.3404705009250121,2,1,pl,WCE,Europe
'a8955ad6a2',extremes,Cold Wave,#a7e9fa,random,zimny trzask,2026-05-21T06:34:00+00:00,,0.3403758701902537,1,1,pl,,
'283b154c38',extremes,Wet Spell,#d60d2b,random,mokre zaklęcie,2026-05-31T06:40:00+00:00,,0.3393392705897449,1,1,pl,,
'fdc4a47653',extremes,Thunderstorm,#53785a,wmo,burza województwo łódzkie powiat łódzki,2026-06-01T07:30:00+00:00,Poland,0.3378451735293112,2,1,pl,WCE,Europe
'45480a05ce',extremes,Tropical Cyclone,#4f4f4f,random,tajfun,2026-05-23T05:52:00+00:00,,0.3376654547269969,1,1,pl,,
'4342bebef9',extremes,Thunderstorm,#53785a,wmo,grad województwo mazowieckie powiat płoński,2026-05-30T06:01:00+00:00,Poland,0.3362925143222096,2,1,pl,WCE,Europe
'f8a513bf41',extremes,Tropical Cyclone,#4f4f4f,random,lek,2026-05-18T06:38:00+00:00,,0.3355437320426143,1,2,pl,,
'b6b9a89665',extremes,Thunderstorm,#53785a,wmo,grad województwo małopolskie powiat tarnowski,2026-06-03T07:23:00+00:00,Poland,0.3354084502967215,2,1,pl,WCE,Europe
'de610b4183',extremes,Thunderstorm,#53785a,wmo,burza województwo opolskie powiat strzelecki,2026-05-15T06:09:00+00:00,Poland,0.3347890634590632,2,1,pl,WCE,Europe
'd92a2733c7',extremes,Thunderstorm,#53785a,wmo,zła pogoda województwo opolskie powiat prudnicki,2026-06-03T07:23:00+00:00,Poland,0.3345543835743823,2,1,pl,WCE,Europe
'ab700fea8e',extremes,Thunderstorm,#53785a,wmo,grad województwo śląskie powiat mysłowicki,2026-06-01T07:30:00+00:00,Poland,0.3342905871770517,2,1,pl,WCE,Europe
'c8012bbd67',extremes,Thunderstorm,#53785a,wmo,burza województwo śląskie powiat gliwicki,2026-05-15T06:09:00+00:00,Poland,0.3339761755423958,2,1,pl,WCE,Europe
'827555c97f',extremes,Thunderstorm,#53785a,wmo,ciężka pogoda województwo śląskie powiat częstochowski,2026-05-30T06:01:00+00:00,Poland,0.3332632032577016,2,1,pl,WCE,Europe
'ef54296dab',extremes,Snow&Ice,#d60d2b,random,kry,2026-05-07T05:46:00+00:00,,0.33085825468506,2,3,pl,,
'892cc44eb5',extremes,Storm,#b3b2b1,wmo,fala sztormowa województwo podlaskie powiat łomżyński,2026-05-19T06:33:00+00:00,Poland,0.3302526171351494,3,1,pl,WCE,Europe
'cee8263770',extremes,Thunderstorm,#53785a,wmo,grad województwo śląskie powiat raciborski,2026-05-15T06:09:00+00:00,Poland,0.32874130644001,2,1,pl,WCE,Europe
'8c57f00f55',extremes,Thunderstorm,#53785a,wmo,burza województwo mazowieckie powiat płocki,2026-05-18T06:38:00+00:00,Poland,0.328606017169234,2,1,pl,WCE,Europe
'9a0bd62f80',extremes,Thunderstorm,#53785a,wmo,burza województwo śląskie powiat teski,2026-05-15T06:09:00+00:00,Poland,0.32851200580441,2,1,pl,WCE,Europe
'e78c66f453',extremes,Thunderstorm,#53785a,wmo,grad województwo podlaskie powiat kolneński,2026-05-19T06:33:00+00:00,Poland,0.3284049394985493,2,1,pl,WCE,Europe
'f1d3442696',extremes,Drought,#edc291,edo,susza na Ukrainie,2026-05-22T06:32:00+00:00,Ukraine,0.3277259775964361,2,1,pl,WCE,Europe
'71edd4d64c',extremes,Thunderstorm,#53785a,wmo,burza województwo lubelskie powiat łukowski,2026-05-18T06:38:00+00:00,Poland,0.3274472754981133,2,1,pl,WCE,Europe
'1b44bdf6d8',extremes,Thunderstorm,#53785a,wmo,grad województwo pomorskie powiat sztumski,2026-05-19T06:33:00+00:00,Poland,0.3260014938168185,2,1,pl,WCE,Europe
'a2c04f9dbc',extremes,Thunderstorm,#53785a,wmo,grad województwo podlaskie powiat łomżyński,2026-05-18T06:38:00+00:00,Poland,0.3235620191808859,2,1,pl,WCE,Europe
'05bc5e8869',extremes,Thunderstorm,#53785a,wmo,burza województwo śląskie powiat cieszyński,2026-05-15T06:09:00+00:00,Poland,0.3231912062876756,2,1,pl,WCE,Europe
'b1fa2721ac',extremes,Thunderstorm,#53785a,wmo,burza województwo łódzkie powiat tomaszowski,2026-05-15T06:09:00+00:00,Poland,0.3231900570165414,2,1,pl,WCE,Europe
'34ac923bcb',extremes,Thunderstorm,#53785a,wmo,grad województwo lubelskie powiat bialski,2026-05-19T06:33:00+00:00,Poland,0.322932129897049,2,1,pl,WCE,Europe
'51cb3aafe7',extremes,Thunderstorm,#53785a,wmo,zła pogoda województwo lubelskie powiat chełmski,2026-05-20T06:33:00+00:00,Poland,0.3227275315561978,2,1,pl,WCE,Europe
'7f2205eb8e',extremes,Thunderstorm,#53785a,wmo,grad województwo mazowieckie powiat płocki,2026-05-18T06:38:00+00:00,Poland,0.3226791174148294,2,1,pl,WCE,Europe
'59a78679b0',extremes,Thunderstorm,#53785a,wmo,surowa pogoda województwo łódzkie powiat pabianicki,2026-05-15T06:09:00+00:00,Poland,0.3225134061072616,2,1,pl,WCE,Europe
'90301ff508',extremes,Thunderstorm,#53785a,wmo,zła pogoda województwo łódzkie powiat pajęczański,2026-05-15T06:09:00+00:00,Poland,0.3219064089708938,2,1,pl,WCE,Europe
'7d5c66bec7',extremes,Thunderstorm,#53785a,wmo,zła pogoda województwo mazowieckie powiat płocki,2026-05-15T06:09:00+00:00,Poland,0.3217188160244327,2,1,pl,WCE,Europe
'6aebb13d2a',extremes,Thunderstorm,#53785a,wmo,burza województwo lubelskie powiat chełmski,2026-05-16T05:40:00+00:00,Poland,0.3215120111208339,2,1,pl,WCE,Europe
'019eb9a987',extremes,Thunderstorm,#53785a,wmo,burza województwo opolskie powiat nyski,2026-05-19T06:33:00+00:00,Poland,0.3212605346705161,2,1,pl,WCE,Europe
'3de067c3c7',extremes,Thunderstorm,#53785a,wmo,zła pogoda województwo podlaskie powiat łomżyński,2026-05-19T06:33:00+00:00,Poland,0.3212466650392458,2,1,pl,WCE,Europe
'e3ad805c55',extremes,Thunderstorm,#53785a,wmo,grad województwo mazowieckie powiat łosicki,2026-05-18T06:38:00+00:00,Poland,0.319643498154358,2,1,pl,WCE,Europe
'8a4f78850e',extremes,Thunderstorm,#53785a,wmo,grad województwo lubelskie powiat zamojski,2026-05-16T05:40:00+00:00,Poland,0.3195481184128471,2,1,pl,WCE,Europe
'd743fc20b4',extremes,Thunderstorm,#53785a,wmo,grad województwo mazowieckie powiat lipski,2026-05-18T06:38:00+00:00,Poland,0.3193068410036786,2,1,pl,WCE,Europe
'eeb879efc0',extremes,Thunderstorm,#53785a,wmo,zła pogoda województwo lubelskie powiat opolski,2026-05-18T06:38:00+00:00,Poland,0.3190736971609231,2,1,pl,WCE,Europe
'e8f35ea4ae',extremes,Thunderstorm,#53785a,wmo,grad województwo pomorskie powiat malborski,2026-05-21T06:35:00+00:00,Poland,0.3187402547087362,2,1,pl,WCE,Europe
'a746af6fa3',extremes,Thunderstorm,#53785a,wmo,burza województwo mazowieckie powiat miński,2026-05-18T06:38:00+00:00,Poland,0.3183322963981686,2,1,pl,WCE,Europe
'46e92f0786',extremes,Thunderstorm,#53785a,wmo,burza województwo lubelskie powiat chełmski,2026-05-15T06:09:00+00:00,Poland,0.3182757716259846,2,1,pl,WCE,Europe
'610f614420',extremes,Thunderstorm,#53785a,wmo,burza województwo pomorskie powiat malborski,2026-05-19T06:33:00+00:00,Poland,0.317933371082341,2,1,pl,WCE,Europe
'9f56f3696e',extremes,Drought,#edc291,edo,okres suszy na Litwie,2026-05-24T06:22:00+00:00,Lithuania,0.3178743484139623,2,1,pl,WCE,Europe
'97b73cb611',extremes,Thunderstorm,#53785a,wmo,grad województwo mazowieckie powiat siedlecki,2026-05-18T06:38:00+00:00,Poland,0.3175041904642038,2,1,pl,WCE,Europe
'76a7ec8880',extremes,Thunderstorm,#53785a,wmo,burza województwo lubelskie powiat radzyński,2026-05-18T06:38:00+00:00,Poland,0.3165501971286631,2,1,pl,WCE,Europe
'16d3e8c67e',extremes,Thunderstorm,#53785a,wmo,burza województwo mazowieckie powiat łosicki,2026-05-20T06:33:00+00:00,Poland,0.314803352181626,2,1,pl,WCE,Europe
'c95fa05df8',extremes,Thunderstorm,#53785a,wmo,grad województwo opolskie powiat oleski,2026-05-15T06:09:00+00:00,Poland,0.3141833164221528,2,1,pl,WCE,Europe
'845dd2d698',extremes,Storm,#b3b2b1,random,tornado,2026-05-19T06:33:00+00:00,,0.3050557440087534,2,1,pl,,
'5ddc2bcd1c',extremes,Snow Avalanche,#deddd5,wmo,lawina w Rosji,2026-05-16T05:40:00+00:00,Russia,0.2997471059373525,3,2,pl,ESB,Europe
'40f675561f',extremes,Heat Wave,#c40202,random,najgorętsze lato,2026-05-22T06:31:00+00:00,,0.2882344226265173,2,1,pl,,
'3ada232977',extremes,Thunderstorm,#53785a,wmo,grad województwo małopolskie powiat krakowski,2026-05-30T06:01:00+00:00,Poland,0.2880455151738401,3,1,pl,WCE,Europe
'ce37661cdd',extremes,Cold Wave,#a7e9fa,random,najzimniejszy dzień,2026-05-26T06:31:00+00:00,,0.2879370297755826,2,1,pl,,
