index,module,topic,color,feed,term,created,country,ratio,counter,pages,language,ipcc,continent
'a22387ad2e',extremes,Precipitation,#d60d2b,wmo,deszczowa polska,2026-04-19T05:16:00+00:00,Poland,0.5280974297783133,1,1,pl,WCE,Europe
'fe9f06f03f',extremes,Storm,#b3b2b1,wmo,burza województwo lubelskie powiat kraśnicki,2026-04-26T05:25:00+00:00,Poland,0.5280115345426263,1,1,pl,WCE,Europe
'9e020e244e',extremes,Drought,#edc291,edo,susza w polsce,2026-04-26T05:25:00+00:00,Poland,0.5197845122495816,2,1,pl,WCE,Europe
'9f56f3696e',extremes,Drought,#edc291,edo,okres suszy na Litwie,2026-04-07T04:59:00+00:00,Lithuania,0.5181380775752361,1,1,pl,WCE,Europe
'da1d506ce7',extremes,Fog,#d60d2b,wmo,mgła województwo pomorskie powiat słupski,2026-04-17T05:16:00+00:00,Poland,0.5141489197592211,2,1,pl,WCE,Europe
'2206074bfa',extremes,Precipitation,#d60d2b,wmo,ulewa polska,2026-04-19T05:16:00+00:00,Poland,0.5137534610291165,1,1,pl,WCE,Europe
'1e5e9285cc',extremes,Storm,#b3b2b1,wmo,burza województwo śląskie powiat mikołowski,2026-05-12T05:52:00+00:00,Poland,0.5122049260009879,1,1,pl,WCE,Europe
'5faf94cbd6',extremes,Precipitation,#d60d2b,wmo,ulewa województwo łódzkie powiat łęczycki,2026-04-20T05:27:00+00:00,Poland,0.5098139875267836,1,1,pl,WCE,Europe
'0e27a49222',extremes,Fog,#d60d2b,wmo,mgła w zachodniej strefie przybrzeżnej,2026-04-17T05:16:00+00:00,Poland,0.5083546455426146,2,1,pl,WCE,Europe
'e1fcc83a8b',extremes,Snow&Ice,#d60d2b,wmo,mróz województwo lubelskie powiat janowski,2026-04-10T05:13:00+00:00,Poland,0.5067262006571621,1,1,pl,WCE,Europe
'2180c0c4a1',extremes,Drought,#edc291,edo,brak opadów w polsce,2026-04-19T05:16:00+00:00,Poland,0.5002142695277447,3,1,pl,WCE,Europe
'f90601fa23',extremes,Volcano,#b83202,random,erupcja wulkanu,2026-04-07T04:58:00+00:00,,0.4988064452251044,1,2,pl,,
'3fe481b522',extremes,Storm,#b3b2b1,wmo,fala sztormowa w środkowej strefie przybrzeżnej,2026-04-17T05:16:00+00:00,Poland,0.4974606164407086,1,1,pl,WCE,Europe
'24d2691c0b',extremes,Storm,#b3b2b1,wmo,burza województwo śląskie powiat rybnicki,2026-05-12T05:52:00+00:00,Poland,0.4894902083777661,1,1,pl,WCE,Europe
'f795b27f6e',extremes,Storm,#b3b2b1,wmo,burza województwo mazowieckie powiat otwocki,2026-04-26T05:25:00+00:00,Poland,0.4891986210119643,1,1,pl,WCE,Europe
'4340c9e06c',extremes,Snow&Ice,#d60d2b,wmo,mroźna polska,2026-04-09T04:58:00+00:00,Poland,0.4890232430587206,2,1,pl,WCE,Europe
'40b7000e71',extremes,Storm,#b3b2b1,wmo,fala sztormowa w polsce,2026-04-25T05:00:00+00:00,Poland,0.4879719535483229,2,1,pl,WCE,Europe
'725f20a0fb',extremes,Storm,#b3b2b1,wmo,wezbranie sztormowe województwo małopolskie powiat olkuski,2026-05-12T05:52:00+00:00,Poland,0.4874073303160109,1,1,pl,WCE,Europe
'628c73fc75',extremes,Drought,#edc291,edo,susza w polsce,2026-04-11T04:34:00+00:00,Poland,0.4829186405913172,5,2,pl,WCE,Europe
'3292e576a4',extremes,Storm,#b3b2b1,wmo,sztorm na wschodniej strefie przybrzeżnej,2026-04-25T05:00:00+00:00,Poland,0.4817568093462099,1,1,pl,WCE,Europe
'13329f4bf1',extremes,Snow&Ice,#d60d2b,wmo,marznąca Polska,2026-04-10T05:13:00+00:00,Poland,0.4814821143788726,2,1,pl,WCE,Europe
'2689ec9210',extremes,Storm,#b3b2b1,wmo,burza województwo podlaskie powiat moniecki,2026-04-06T05:11:00+00:00,Poland,0.4808189911205617,1,1,pl,WCE,Europe
'6fbebc79f4',extremes,Storm,#b3b2b1,wmo,wezbranie sztormowe województwo łódzkie powiat tomaszowski,2026-04-26T05:25:00+00:00,Poland,0.4807580658662529,1,1,pl,WCE,Europe
'5905e9f08d',extremes,Storm,#b3b2b1,wmo,fala sztormowa województwo mazowieckie powiat radomski,2026-04-26T05:25:00+00:00,Poland,0.4804227275684998,1,1,pl,WCE,Europe
'c2a1de8dc8',extremes,Storm,#b3b2b1,wmo,burza Polska,2026-04-25T05:00:00+00:00,Poland,0.4794858686866671,3,2,pl,WCE,Europe
'f3e42f0307',extremes,Storm,#b3b2b1,wmo,burza województwo podlaskie powiat sokólski,2026-05-12T05:52:00+00:00,Poland,0.4790969654835386,1,1,pl,WCE,Europe
'510ed94b67',extremes,Storm,#b3b2b1,wmo,burza województwo podkarpackie powiat leski,2026-05-12T05:52:00+00:00,Poland,0.478891480442936,1,1,pl,WCE,Europe
'fd1d8250b9',extremes,Storm,#b3b2b1,wmo,burza województwo śląskie powiat cieszyński,2026-05-12T05:52:00+00:00,Poland,0.4788058686250413,1,1,pl,WCE,Europe
'94495c8d88',extremes,Storm,#b3b2b1,wmo,burza województwo lubelskie powiat bialski,2026-04-07T04:59:00+00:00,Poland,0.4780860002891569,1,1,pl,WCE,Europe
'4c15cd9081',extremes,Storm,#b3b2b1,wmo,wezbranie sztormowe województwo małopolskie powiat tarnowski,2026-04-26T05:25:00+00:00,Poland,0.4770072865317451,1,1,pl,WCE,Europe
'35e377bb6e',extremes,Storm,#b3b2b1,wmo,burza województwo lubelskie powiat opolski,2026-04-26T05:25:00+00:00,Poland,0.4752246629296355,1,1,pl,WCE,Europe
'2609bda0f2',extremes,Snow&Ice,#d60d2b,wmo,lodowa Polska,2026-04-09T04:58:00+00:00,Poland,0.4750637966894401,2,1,pl,WCE,Europe
'624bd2f0ee',extremes,Precipitation,#d60d2b,wmo,ulewne deszcze województwo łódzkie powiat łaski,2026-04-19T05:16:00+00:00,Poland,0.4723989551222537,1,1,pl,WCE,Europe
'f3c258d60c',extremes,Thunderstorm,#53785a,wmo,zła pogoda województwo lubelskie powiat łęczyński,2026-05-07T05:46:00+00:00,Poland,0.4716607499735905,1,1,pl,WCE,Europe
'6e288119bc',extremes,Precipitation,#d60d2b,wmo,opady w polsce,2026-03-26T04:56:00+00:00,Poland,0.4702201585421259,2,3,pl,WCE,Europe
'b132015d67',extremes,Storm,#b3b2b1,wmo,wezbranie sztormowe województwo śląskie powiat rybnicki,2026-05-12T05:52:00+00:00,Poland,0.470056233847747,1,1,pl,WCE,Europe
'fffa920622',extremes,Storm,#b3b2b1,wmo,fala sztormowa województwo mazowieckie powiat miński,2026-04-06T05:11:00+00:00,Poland,0.4673386992444792,1,1,pl,WCE,Europe
'cef815b506',extremes,Storm,#b3b2b1,wmo,fala sztormowa województwo lubelskie powiat zamojski,2026-05-12T05:52:00+00:00,Poland,0.4666227400124458,1,1,pl,WCE,Europe
'15a9c61e3e',extremes,Landslide,#572c03,random,osuwisko,2026-04-20T05:26:00+00:00,,0.4665950743806126,1,2,pl,,
'c696ff6f0d',extremes,Storm,#b3b2b1,wmo,burza województwo łódzkie powiat rawski,2026-04-26T05:25:00+00:00,Poland,0.466593283544217,1,1,pl,WCE,Europe
'906b587502',extremes,Storm,#b3b2b1,wmo,burza województwo pomorskie powiat lęborski,2026-04-05T05:01:00+00:00,Poland,0.465481247931507,1,1,pl,WCE,Europe
'c520df0cc2',extremes,Storm,#b3b2b1,wmo,fala sztormowa województwo lubelskie powiat zamojski,2026-04-06T05:11:00+00:00,Poland,0.4653627941732445,1,1,pl,WCE,Europe
'd546367e35',extremes,Storm,#b3b2b1,wmo,fala sztormowa województwo podlaskie powiat białostocki,2026-04-06T05:11:00+00:00,Poland,0.4650542943713228,1,1,pl,WCE,Europe
'9558667e31',extremes,Storm,#b3b2b1,wmo,wezbranie sztormowe województwo łódzkie powiat opoczyński,2026-04-06T05:11:00+00:00,Poland,0.4648085741528393,1,1,pl,WCE,Europe
'258c60ed39',extremes,Storm,#b3b2b1,wmo,burza województwo śląskie powiat bielski,2026-05-11T06:14:00+00:00,Poland,0.4638162505310031,1,1,pl,WCE,Europe
'e5608d7c1d',extremes,Storm,#b3b2b1,wmo,fala sztormowa województwo podlaskie powiat łomżyński,2026-04-07T04:59:00+00:00,Poland,0.4631504081844223,1,1,pl,WCE,Europe
'2d4cf5b870',extremes,Storm,#b3b2b1,wmo,burza województwo łódzkie powiat brzeziński,2026-04-06T05:11:00+00:00,Poland,0.4626474186264062,1,1,pl,WCE,Europe
'bce7bb9084',extremes,Storm,#b3b2b1,wmo,wezbranie sztormowe województwo łódzkie powiat poddębicki,2026-04-06T05:11:00+00:00,Poland,0.4613707257251632,1,1,pl,WCE,Europe
'958448c5c5',extremes,Storm,#b3b2b1,wmo,burza województwo pomorskie powiat pucki,2026-04-25T05:00:00+00:00,Poland,0.4611101049352892,2,1,pl,WCE,Europe
'8a6b3dde18',extremes,Precipitation,#d60d2b,wmo,ulewa województwo lubuskie powiat wschowski,2026-04-20T05:27:00+00:00,Poland,0.4597599869588196,1,1,pl,WCE,Europe
'c09eae6329',extremes,Storm,#b3b2b1,wmo,burza województwo lubelskie powiat chełmski,2026-04-07T04:59:00+00:00,Poland,0.4595334538194961,1,1,pl,WCE,Europe
'd59a7e48d7',extremes,Drought,#edc291,random,ewapotranspiracja,2026-04-16T05:16:00+00:00,,0.4595173345855033,1,2,pl,,
'0d23c57059',extremes,Storm,#b3b2b1,wmo,burza województwo wielkopolskie powiat koniński,2026-04-06T05:11:00+00:00,Poland,0.4593145495174371,1,1,pl,WCE,Europe
'e5ff5d34c8',extremes,Storm,#b3b2b1,wmo,burza województwo łódzkie powiat łęczycki,2026-04-06T05:11:00+00:00,Poland,0.4588748767058999,1,1,pl,WCE,Europe
'86d9dc697b',extremes,Storm,#b3b2b1,wmo,burza województwo lubelskie powiat lubelski,2026-04-06T05:11:00+00:00,Poland,0.4586690643771569,1,1,pl,WCE,Europe
'e225a247b0',extremes,Thunderstorm,#53785a,wmo,burza z piorunami na Litwie,2026-05-06T05:43:00+00:00,Lithuania,0.4579622911625841,1,1,pl,WCE,Europe
'7392131591',extremes,Storm,#b3b2b1,wmo,burza województwo opolskie powiat brzeski,2026-05-11T06:14:00+00:00,Poland,0.4577580020122263,1,1,pl,WCE,Europe
'776fe47817',extremes,Wildfire,#d60d2b,random,pożar,2026-04-08T05:00:00+00:00,,0.4573229400288158,1,3,pl,,
'879aed5b1e',extremes,Storm,#b3b2b1,wmo,fala sztormowa województwo lubelskie powiat włodawski,2026-04-07T04:59:00+00:00,Poland,0.4558980450629952,1,1,pl,WCE,Europe
'd0f7bd20e5',extremes,Storm,#b3b2b1,wmo,burza województwo małopolskie powiat suski,2026-04-26T05:25:00+00:00,Poland,0.4540136112537724,2,1,pl,WCE,Europe
'516da68350',extremes,Storm,#b3b2b1,wmo,burza województwo lubelskie powiat świdnicki,2026-04-26T05:25:00+00:00,Poland,0.4540111415626559,2,1,pl,WCE,Europe
'1af313a328',extremes,Thunderstorm,#53785a,wmo,witaj polsko,2026-05-07T05:46:00+00:00,Poland,0.4531126364541854,2,1,pl,WCE,Europe
'5adf90546e',extremes,Storm,#b3b2b1,wmo,fala sztormowa województwo mazowieckie powiat siedlecki,2026-04-26T05:25:00+00:00,Poland,0.4521698840574381,2,1,pl,WCE,Europe
'86cccd975e',extremes,Storm,#b3b2b1,wmo,burza województwo lubelskie powiat rycki,2026-04-26T05:25:00+00:00,Poland,0.4513679824294805,2,1,pl,WCE,Europe
'afc70a952a',extremes,Storm,#b3b2b1,wmo,fala sztormowa województwo śląskie powiat sosnowiecki,2026-04-26T05:25:00+00:00,Poland,0.4513261816111839,2,1,pl,WCE,Europe
'1029681b82',extremes,Storm,#b3b2b1,wmo,fala sztormowa województwo śląskie powiat teski,2026-04-26T05:25:00+00:00,Poland,0.4503819802763739,2,1,pl,WCE,Europe
'b7f75a1587',extremes,Thunderstorm,#53785a,wmo,zła pogoda województwo małopolskie powiat krakowski,2026-05-07T05:46:00+00:00,Poland,0.4491249885603063,1,1,pl,WCE,Europe
'0a067fb676',extremes,Storm,#b3b2b1,wmo,fala sztormowa województwo śląskie powiat mysłowicki,2026-04-26T05:25:00+00:00,Poland,0.4484175547242143,2,1,pl,WCE,Europe
'47d4322322',extremes,Storm,#b3b2b1,wmo,burza województwo lubelskie powiat zamojski,2026-04-07T04:59:00+00:00,Poland,0.4466269683683208,1,1,pl,WCE,Europe
'a49e7eb6c9',extremes,Thunderstorm,#53785a,wmo,burza województwo pomorskie powiat sopocki,2026-05-11T06:14:00+00:00,Poland,0.4464125767403628,1,1,pl,WCE,Europe
'102f0c17ef',extremes,Storm,#b3b2b1,wmo,burza województwo lubelskie powiat łukowski,2026-04-26T05:25:00+00:00,Poland,0.4455201882591681,2,1,pl,WCE,Europe
'fbfbc528cc',extremes,Storm,#b3b2b1,wmo,burza województwo mazowieckie powiat mławski,2026-04-26T05:25:00+00:00,Poland,0.4455185713853307,2,1,pl,WCE,Europe
'6016a96c2e',extremes,Storm,#b3b2b1,wmo,fala sztormowa województwo małopolskie powiat suski,2026-05-11T06:14:00+00:00,Poland,0.445412241248057,2,1,pl,WCE,Europe
'535dd9c2f1',extremes,Storm,#b3b2b1,wmo,burza województwo pomorskie powiat gdyński,2026-04-25T05:00:00+00:00,Poland,0.4450938129370546,2,1,pl,WCE,Europe
'428c9fc794',extremes,Storm,#b3b2b1,wmo,fala sztormowa województwo podlaskie powiat suwalski,2026-04-07T04:59:00+00:00,Poland,0.445028373306324,1,1,pl,WCE,Europe
'53fda39314',extremes,Drought,#edc291,edo,brak opadów na Litwie,2026-04-15T05:12:00+00:00,Lithuania,0.4446610651211587,2,1,pl,WCE,Europe
'a7491328f2',extremes,Precipitation,#d60d2b,wmo,ulewne deszcze województwo śląskie powiat lubliniecki,2026-04-20T05:27:00+00:00,Poland,0.4446029764054924,2,1,pl,WCE,Europe
'95f4812f42',extremes,Thunderstorm,#53785a,wmo,grad województwo pomorskie powiat gdański,2026-05-11T06:14:00+00:00,Poland,0.4433242966830741,1,1,pl,WCE,Europe
'364a1fa5ec',extremes,Storm,#b3b2b1,wmo,fala sztormowa we wschodniej strefie przybrzeżnej,2026-04-16T05:17:00+00:00,Poland,0.4426097175060698,2,1,pl,WCE,Europe
'52af874334',extremes,Drought,#edc291,random,suchość,2026-05-07T05:46:00+00:00,,0.4421249395815708,1,2,pl,,
'84dfdca0f8',extremes,Thunderstorm,#53785a,random,grad,2026-04-10T05:12:00+00:00,,0.4396356356531609,1,3,pl,,
'489d1a30e1',extremes,Drought,#edc291,edo,susza na Ukrainie,2026-04-16T05:17:00+00:00,Ukraine,0.4384894031371855,1,1,pl,WCE,Europe
'2b60c80456',extremes,Storm,#b3b2b1,wmo,fala sztormowa województwo śląskie powiat żorski,2026-05-11T06:14:00+00:00,Poland,0.4379380349746506,2,1,pl,WCE,Europe
'326831cb12',extremes,Precipitation,#d60d2b,wmo,ulewa województwo łódzkie powiat sieradzki,2026-04-19T05:16:00+00:00,Poland,0.4373594203150071,2,1,pl,WCE,Europe
'c1fe854a19',extremes,Precipitation,#d60d2b,wmo,ulewa województwo łódzkie powiat zgierski,2026-04-19T05:16:00+00:00,Poland,0.4361243102170656,2,1,pl,WCE,Europe
'ae6765fbfd',extremes,Precipitation,#d60d2b,wmo,ulewne deszcze województwo łódzkie powiat łódzki,2026-04-19T05:16:00+00:00,Poland,0.4348932512590244,2,1,pl,WCE,Europe
'e03a6b73d5',extremes,Storm,#b3b2b1,wmo,fala sztormowa województwo opolskie powiat strzelecki,2026-05-11T06:14:00+00:00,Poland,0.4345558973588017,2,1,pl,WCE,Europe
'1c4e7fb6c7',extremes,Fog,#d60d2b,wmo,mgła na Litwie,2026-04-16T05:17:00+00:00,Lithuania,0.4342954528729659,2,1,pl,WCE,Europe
'b29921c53c',extremes,Precipitation,#d60d2b,wmo,deszcz województwo łódzkie powiat łódzki,2026-04-20T05:27:00+00:00,Poland,0.4340145901369698,2,1,pl,WCE,Europe
'6389edd212',extremes,Thunderstorm,#53785a,wmo,burza z piorunami województwo podkarpackie powiat leski,2026-05-07T05:46:00+00:00,Poland,0.4338609237405901,1,1,pl,WCE,Europe
'933fd51796',extremes,Thunderstorm,#53785a,wmo,grad województwo podkarpackie powiat leski,2026-05-08T05:16:00+00:00,Poland,0.4333356720220104,1,1,pl,WCE,Europe
'447adfff2e',extremes,Precipitation,#d60d2b,wmo,deszczowe województwo śląskie powiat myszkowski,2026-04-19T05:16:00+00:00,Poland,0.4332004622999982,2,1,pl,WCE,Europe
'498a6fd5d0',extremes,Snow&Ice,#d60d2b,wmo,śnieg województwo lubelskie powiat świdnicki,2026-04-10T05:13:00+00:00,Poland,0.4317190742136212,2,1,pl,WCE,Europe
'1038f548b4',extremes,Thunderstorm,#53785a,wmo,zła pogoda województwo lubelskie powiat chełmski,2026-05-07T05:46:00+00:00,Poland,0.4309203487378947,1,1,pl,WCE,Europe
'9b187888d2',extremes,Snow&Ice,#d60d2b,wmo,zamarzanie województwo lubelskie powiat lubelski,2026-04-10T05:13:00+00:00,Poland,0.4301552197078707,2,1,pl,WCE,Europe
'1917c242d7',extremes,Thunderstorm,#53785a,wmo,grad województwo lubelskie powiat lubelski,2026-05-07T05:46:00+00:00,Poland,0.4299510079737274,1,1,pl,WCE,Europe
'8352f2224a',extremes,Fog,#d60d2b,wmo,mgła województwo pomorskie powiat gdański,2026-04-17T05:16:00+00:00,Poland,0.42916845964762,3,1,pl,WCE,Europe
'ce7ca89385',extremes,Fog,#d60d2b,wmo,mgła województwo pomorskie powiat słupski,2026-04-17T05:16:00+00:00,Poland,0.4288611363895611,3,1,pl,WCE,Europe
'2752348aea',extremes,Precipitation,#d60d2b,wmo,opady atmosferyczne województwo lubuskie powiat żarski,2026-04-19T05:16:00+00:00,Poland,0.4280432062937329,2,1,pl,WCE,Europe
'45500dcb47',extremes,Precipitation,#d60d2b,random,rekordowe opady,2026-04-25T05:00:00+00:00,,0.427106495446111,1,2,pl,,
'18fe399589',extremes,Storm,#b3b2b1,wmo,fala sztormowa na Litwie,2026-04-23T05:16:00+00:00,Lithuania,0.4267067733124562,2,1,pl,WCE,Europe
'7d96e1e0ea',extremes,Thunderstorm,#53785a,wmo,zła pogoda województwo mazowieckie powiat lipski,2026-05-07T05:46:00+00:00,Poland,0.4266998220766265,1,1,pl,WCE,Europe
'f8a513bf41',extremes,Tropical Cyclone,#4f4f4f,random,lek,2026-04-17T05:15:00+00:00,,0.4259746830548016,1,3,pl,,
'132b89a357',extremes,Snow&Ice,#d60d2b,wmo,litwa śnieżna,2026-05-10T05:51:00+00:00,Lithuania,0.4258032887516215,2,1,pl,WCE,Europe
'3d4dbc8c3b',extremes,Precipitation,#d60d2b,random,ulewny deszcz,2026-04-15T05:11:00+00:00,,0.4251483768142399,1,2,pl,,
'4c473f18e3',extremes,Snow&Ice,#d60d2b,wmo,śnieg województwo lubelskie powiat łęczyński,2026-04-10T05:13:00+00:00,Poland,0.4248570902663768,2,1,pl,WCE,Europe
'd0bd4fb7aa',extremes,Precipitation,#d60d2b,wmo,deszcz ulewny województwo lubuskie powiat wschowski,2026-04-19T05:16:00+00:00,Poland,0.4244337813123763,2,1,pl,WCE,Europe
'8791278548',extremes,Precipitation,#d60d2b,wmo,ulewa województwo łódzkie powiat wieluński,2026-04-20T05:27:00+00:00,Poland,0.4241568289133375,2,1,pl,WCE,Europe
'278c0845bf',extremes,Storm,#b3b2b1,wmo,fala sztormowa województwo podkarpackie powiat leski,2026-05-06T05:43:00+00:00,Poland,0.4231871004733405,2,1,pl,WCE,Europe
'26037c6e0f',extremes,Thunderstorm,#53785a,wmo,"grad, Litwa",2026-05-05T05:29:00+00:00,Lithuania,0.4229958950851258,2,1,pl,WCE,Europe
'ec9781b6b1',extremes,Precipitation,#d60d2b,wmo,ulewa województwo łódzkie powiat piotrkowski,2026-04-20T05:27:00+00:00,Poland,0.4229332856656788,2,1,pl,WCE,Europe
'aa2e706f42',extremes,Thunderstorm,#53785a,wmo,grad województwo lubelskie powiat lubelski,2026-05-07T05:46:00+00:00,Poland,0.4216264053069935,1,1,pl,WCE,Europe
'df6261fa7e',extremes,Thunderstorm,#53785a,wmo,zła pogoda województwo małopolskie powiat tarnowski,2026-05-07T05:46:00+00:00,Poland,0.4216131469562914,1,1,pl,WCE,Europe
'4ec60e407f',extremes,Precipitation,#d60d2b,wmo,ulewa województwo małopolskie powiat krakowski,2026-04-20T05:27:00+00:00,Poland,0.4213024852180982,2,1,pl,WCE,Europe
'ca7c25a10a',extremes,Storm,#b3b2b1,wmo,fala sztormowa w zachodniej strefie przybrzeżnej,2026-04-20T05:27:00+00:00,Poland,0.4203870964856849,2,1,pl,WCE,Europe
'14cefd6764',extremes,Storm,#b3b2b1,wmo,burza województwo łódzkie powiat zgierski,2026-05-11T06:14:00+00:00,Poland,0.4189431790462023,2,1,pl,WCE,Europe
'e8e6fb4218',extremes,Precipitation,#d60d2b,wmo,ulewa województwo wielkopolskie powiat koniński,2026-04-20T05:27:00+00:00,Poland,0.4186998104901588,2,1,pl,WCE,Europe
'9aa85864ec',extremes,Storm,#b3b2b1,wmo,fala sztormowa województwo mazowieckie powiat płocki,2026-04-26T05:25:00+00:00,Poland,0.4182060931927068,2,1,pl,WCE,Europe
'15cb1e1745',extremes,Thunderstorm,#53785a,wmo,zła pogoda województwo lubelskie powiat janowski,2026-05-07T05:46:00+00:00,Poland,0.4179938708275262,1,1,pl,WCE,Europe
'1d9c104bbb',extremes,Storm,#b3b2b1,wmo,burza na Litwie,2026-04-26T05:25:00+00:00,Lithuania,0.4179894211562517,2,1,pl,WCE,Europe
'8a4808840b',extremes,Thunderstorm,#53785a,wmo,zła pogoda województwo lubelskie powiat kraśnicki,2026-05-07T05:46:00+00:00,Poland,0.4179454398326356,1,1,pl,WCE,Europe
'51740b1fc3',extremes,Snow&Ice,#d60d2b,wmo,zamarzanie województwo lubelskie powiat chełmski,2026-04-10T05:13:00+00:00,Poland,0.4178473698201654,2,1,pl,WCE,Europe
'84c9d082f8',extremes,Storm,#b3b2b1,wmo,fala sztormowa województwo śląskie powiat żywiecki,2026-05-11T06:14:00+00:00,Poland,0.417488898965168,2,1,pl,WCE,Europe
'91377cc2a9',extremes,Drought,#edc291,acwe,susza w południowej Australii,2026-03-31T05:00:00+00:00,Australia,0.417363691783762,1,2,pl,SAU,Oceania
'bf19124963',extremes,Storm,#b3b2b1,wmo,burza województwo podkarpackie powiat krośnieński,2026-04-26T05:25:00+00:00,Poland,0.4171820155979054,2,1,pl,WCE,Europe
'1132e38d50',extremes,Storm,#b3b2b1,wmo,burza województwo małopolskie powiat olkuski,2026-05-07T05:46:00+00:00,Poland,0.4169649887689171,2,1,pl,WCE,Europe
'dc5bf960b0',extremes,Snow&Ice,#d60d2b,random,burza śnieżna,2026-05-06T05:43:00+00:00,,0.4166414230260499,1,2,pl,,
'5b33a8ba38',extremes,Storm,#b3b2b1,wmo,fala sztormowa województwo śląskie powiat bytomski,2026-04-26T05:25:00+00:00,Poland,0.416273606202613,2,1,pl,WCE,Europe
'6029cfd5c9',extremes,Precipitation,#d60d2b,wmo,ulewne deszcze województwo małopolskie powiat brzeski,2026-04-20T05:27:00+00:00,Poland,0.4160713216252699,2,1,pl,WCE,Europe
'fe732a9082',extremes,Storm,#b3b2b1,wmo,burza województwo śląskie powiat chorzowski,2026-05-11T06:14:00+00:00,Poland,0.4159159791700778,2,1,pl,WCE,Europe
'cba9cbfddd',extremes,Thunderstorm,#53785a,wmo,grad województwo lubelskie powiat puławski,2026-05-07T05:46:00+00:00,Poland,0.4135338839427409,2,1,pl,WCE,Europe
'f81802c0d3',extremes,Storm,#b3b2b1,wmo,burza województwo pomorskie powiat gdański,2026-04-25T05:00:00+00:00,Poland,0.4121762805034295,2,1,pl,WCE,Europe
'8612e7b92c',extremes,Thunderstorm,#53785a,wmo,grad województwo małopolskie powiat olkuski,2026-05-11T06:14:00+00:00,Poland,0.4120628838276708,1,1,pl,WCE,Europe
'e8c802d6fb',extremes,Storm,#b3b2b1,wmo,burza województwo śląskie powiat będziński,2026-04-26T05:25:00+00:00,Poland,0.4113689534297843,2,1,pl,WCE,Europe
'3921b06b03',extremes,Precipitation,#d60d2b,wmo,ulewne deszcze województwo łódzkie powiat pajęczański,2026-04-19T05:16:00+00:00,Poland,0.411301697888835,2,1,pl,WCE,Europe
'c7c86df95e',extremes,Storm,#b3b2b1,wmo,burza w Izraelu,2026-03-31T04:59:00+00:00,Israel,0.4097967500671853,1,2,pl,MED,Asia
'966a6e8bf2',extremes,Storm,#b3b2b1,wmo,fala sztormowa województwo małopolskie powiat brzeski,2026-04-26T05:25:00+00:00,Poland,0.409209243996569,2,1,pl,WCE,Europe
'6c11585835',extremes,Drought,#edc291,edo,susza na Litwie,2026-04-16T05:17:00+00:00,Lithuania,0.4087347858469662,2,1,pl,WCE,Europe
'f56f16ccb9',extremes,Storm,#b3b2b1,wmo,fala sztormowa województwo małopolskie powiat krakowski,2026-04-26T05:25:00+00:00,Poland,0.4086235463739126,2,1,pl,WCE,Europe
'cfe6434c64',extremes,Precipitation,#d60d2b,wmo,deszcz ulewny województwo lubuskie powiat żagański,2026-04-19T05:16:00+00:00,Poland,0.4077799442445197,2,1,pl,WCE,Europe
'79a8acb212',extremes,Storm,#b3b2b1,wmo,burza województwo łódzkie powiat opoczyński,2026-04-26T05:25:00+00:00,Poland,0.4075940537477707,2,1,pl,WCE,Europe
'4354f5c317',extremes,Thunderstorm,#53785a,wmo,grad województwo śląskie powiat lubliniecki,2026-05-11T06:14:00+00:00,Poland,0.4073949890384472,1,1,pl,WCE,Europe
'560b05d603',extremes,Heat Wave,#c40202,random,fala upałów,2026-05-01T05:54:00+00:00,,0.4072135104472461,1,2,pl,,
'e39a0c7809',extremes,Storm,#b3b2b1,wmo,fala sztormowa województwo śląskie powiat chorzowski,2026-04-26T05:25:00+00:00,Poland,0.4070383899399666,2,1,pl,WCE,Europe
'9eb5abf250',extremes,Storm,#b3b2b1,wmo,burza województwo mazowieckie powiat płoński,2026-04-26T05:25:00+00:00,Poland,0.4067737252233587,2,1,pl,WCE,Europe
'7b765a4d4c',extremes,Precipitation,#d60d2b,random,ulewa,2026-04-13T05:27:00+00:00,,0.406693475866487,2,1,pl,,
'f3b91506ec',extremes,Cold Wave,#a7e9fa,random,rekordowo zimno,2026-04-07T04:58:00+00:00,,0.4066538006246762,2,2,pl,,
'5ddf9d818d',extremes,Storm,#b3b2b1,wmo,burza województwo śląskie powiat katowicki,2026-04-26T05:25:00+00:00,Poland,0.4064277551582653,2,1,pl,WCE,Europe
'282655a0fb',extremes,Storm,#b3b2b1,wmo,burza województwo śląskie powiat raciborski,2026-05-11T06:14:00+00:00,Poland,0.4056654964204857,2,1,pl,WCE,Europe
'fb434384c8',extremes,Storm,#b3b2b1,wmo,fala sztormowa województwo opolskie powiat opolski,2026-05-11T06:14:00+00:00,Poland,0.4048240225513181,2,1,pl,WCE,Europe
'06bcfff36d',extremes,Storm,#b3b2b1,wmo,burza województwo małopolskie powiat krakowski,2026-05-11T06:14:00+00:00,Poland,0.4047558706094181,2,1,pl,WCE,Europe
'98db96b6de',extremes,Drought,#edc291,edo,susza na Litwie,2026-04-21T05:15:00+00:00,Lithuania,0.403773670363581,2,1,pl,WCE,Europe
'a41eb25d17',extremes,Storm,#b3b2b1,wmo,burza województwo lubelskie powiat łęczyński,2026-04-26T05:25:00+00:00,Poland,0.4036418771936776,2,1,pl,WCE,Europe
'775ed8712b',extremes,Storm,#b3b2b1,wmo,fala sztormowa województwo lubelskie powiat lubelski,2026-04-26T05:25:00+00:00,Poland,0.4035125061824575,2,1,pl,WCE,Europe
'8116f2621f',extremes,Precipitation,#d60d2b,wmo,deszcz województwo opolskie powiat oleski,2026-04-19T05:16:00+00:00,Poland,0.403053003274681,2,1,pl,WCE,Europe
'b5578abf37',extremes,Precipitation,#d60d2b,wmo,deszcz ulewny województwo lubuskie powiat gorzowski,2026-04-20T05:27:00+00:00,Poland,0.4022203148152979,2,1,pl,WCE,Europe
'004d2c2888',extremes,Storm,#b3b2b1,wmo,wezbranie sztormowe województwo lubelskie powiat janowski,2026-04-26T05:25:00+00:00,Poland,0.4021535906693116,2,1,pl,WCE,Europe
'20741ce7eb',extremes,Tsunami,#690191,random,tsunami,2026-05-07T05:46:00+00:00,,0.4013632116091791,1,3,pl,,
'84febdd06c',extremes,Thunderstorm,#53785a,random,burza,2026-04-18T04:56:00+00:00,,0.4011683027368015,1,3,pl,,
'6fea2877df',extremes,Storm,#b3b2b1,wmo,burza województwo podlaskie powiat suwalski,2026-04-26T05:25:00+00:00,Poland,0.4009253515947775,2,1,pl,WCE,Europe
'6945b7c1b5',extremes,Storm,#b3b2b1,wmo,burza województwo mazowieckie powiat łosicki,2026-04-26T05:25:00+00:00,Poland,0.4001161002643816,2,1,pl,WCE,Europe
'c485a52f57',extremes,Storm,#b3b2b1,wmo,burza województwo pomorskie powiat słupski,2026-04-25T05:00:00+00:00,Poland,0.3998933647375261,2,1,pl,WCE,Europe
'9737717f4f',extremes,Precipitation,#d60d2b,wmo,deszczowe województwo lubuskie powiat nowosolski,2026-04-20T05:27:00+00:00,Poland,0.3997694642518172,2,1,pl,WCE,Europe
'ce82cacf3c',extremes,Storm,#b3b2b1,wmo,wezbranie sztormowe województwo mazowieckie powiat płoński,2026-05-11T06:14:00+00:00,Poland,0.3992325725350903,2,1,pl,WCE,Europe
'147876226f',extremes,Thunderstorm,#53785a,wmo,ciężka pogoda w polsce,2026-05-07T05:46:00+00:00,Poland,0.3985058214000734,2,1,pl,WCE,Europe
'd0bd3f2033',extremes,Precipitation,#d60d2b,wmo,opady województwo łódzkie powiat wieluński,2026-04-19T05:16:00+00:00,Poland,0.3981843744046826,2,1,pl,WCE,Europe
'62084daeb0',extremes,Earthquake,#870007,random,trzęsienie ziemi,2026-04-11T04:34:00+00:00,,0.3967822185625926,1,3,pl,,
'82d648b882',extremes,Drought,#edc291,random,susza,2026-04-24T05:21:00+00:00,,0.3949233056781246,1,2,pl,,
'0a98fdd376',extremes,Snow Avalanche,#deddd5,random,lawina,2026-04-05T05:00:00+00:00,,0.3944061629059276,1,3,pl,,
